hotelname,title,desc,reviewRatings,reviewDate,hotelClass,hotelRank,polarity,subjectivity,Normalized_Polarity,Normalized_Subjectivity,Normalized_Polarity_POS_NEG,Category
Pan Pacific Singapore,Good atmosphere and Great food,"We ate in Keyaki Japanese restaurant at Pan Pacific Singapore and had the teppanyaki option. We were at the teppanyaki counter and served by the friendly chef Eric Yong. We lived not just his cooking but also his personality. Eric was friendly, sociable and connect very well . Very good experience and keep up the good work.",5 out of 5,February 2023,5.0 of 5 stars,#33 of 372 hotels in Singapore,0.4266666666666666,0.4466666666666667,71.33333333333333,44.66666666666667,42.66666666666666,Services
Pan Pacific Singapore,Excellent choice for wedding anniversary,The experience was fantastic even before we entered the restaurant! There is a beautiful Japanese garden outside the restaurant for nice photographs and the food was amazing with excellent services from Ms Fanny and Mr Jayden!,5 out of 5,February 2023,5.0 of 5 stars,#33 of 372 hotels in Singapore,0.5071428571428572,0.6928571428571428,75.35714285714286,69.28571428571428,50.71428571428572,Amenities
Pan Pacific Singapore,Teppanyaki was great,"The food was really good, we had the Ten set menu. The service by Chef Tommy yeo was even better. He made the experience 100x better. Especially the lobster which he made in a different style. Overall really worth the trip down.",5 out of 5,February 2023,5.0 of 5 stars,#33 of 372 hotels in Singapore,0.20493827160493827,0.39876543209876547,60.24691358024692,39.876543209876544,20.493827160493826,Amenities
Pan Pacific Singapore,Kyoto ‘feel’ dining,"Pretty Japanese sen Kyoto feeling place. Not too crowded. Such an experience. Each dish serve quite timely no rush and totally enjoyed! Good wish was still ok. Fresh and nicely cook, pretty standard. Was serve by Fanny and Jayden. Less speaking and refill the drink fast and clean the tablet before the next time serve. Thumb up for the services crew!",5 out of 5,February 2023,5.0 of 5 stars,#33 of 372 hotels in Singapore,0.25892857142857145,0.511904761904762,62.94642857142857,51.1904761904762,25.892857142857146,Amenities
Pan Pacific Singapore,Best Teppanyaki in Singapore.,"We have been to this restaurant many times over the last 30 years and it is by far the best Teppanyaki restaurant in Singapore after all these years. This is largely due to the fact that Eamon Chan is the same chef that has been serving us over the last 30 years. His years of experience shows through in the perfectly cooked beef and seafood. We ordered both the lobster and beef sets and both sets have salmon, scallops & tiger prawns; extremely good value for money. Would keep going back there again and again",5 out of 5,February 2023,5.0 of 5 stars,#33 of 372 hotels in Singapore,0.3175,0.4033333333333333,65.875,40.33333333333333,31.75,Amenities
Pan Pacific Singapore,Best Teppanyaki in Singapore,"Very good Teppanyaki in Keyaki, Pan Pacific Hotel. Have been a customer of this restaurant for more than 30 years. Food is very fresh and chef Eamon always served up high quality Teppanyaki. Food is cooked to perfection, from seafood to meats, and chef Eamon is very skilled in Teppanyaki moves",5 out of 5,February 2023,5.0 of 5 stars,#33 of 372 hotels in Singapore,0.522,0.624,76.1,62.4,52.2,Amenities
Pan Pacific Singapore,Fantastic Sunday Brunch with Friends at Edge,We did our Edge Sunday Brunch booking and reservation was taken by Janice Chan. It was fuss free and immediately confirmed. Service is exceptional and foods are delicious and well prepared as always. Seafoods are fresh and cooked foods taste wondeful.,5 out of 5,February 2023,5.0 of 5 stars,#33 of 372 hotels in Singapore,0.5533333333333333,0.86,77.66666666666666,86.0,55.333333333333336,Services
Pan Pacific Singapore,Dinner at the Edge,It was a great experience with friends. We really enjoyed the food and they have a wife variety of choices. I really love seafoods and I am very glad that they served fresh seafoods. 😍 Worth the price! And I also want to thank Janice for being so welcoming and very approachable with her sweet smile. Thanks for the experience! We will definitely come back again. 😋😉,5 out of 5,February 2023,5.0 of 5 stars,#33 of 372 hotels in Singapore,0.3520833333333333,0.44999999999999996,67.60416666666667,44.99999999999999,35.20833333333333,Services
Pan Pacific Singapore,Birthday Dinner,Celebrating my birthday in the Japanese Restaurant- Keyaki. Was served by Jeff and Elsa. They have been very attentive in serving us throughout the evening. They have been extremely helpful in explaining and also recommending their food to us. We totally enjoyed our dinner there. Thanks Jeff and Elsa.,5 out of 5,February 2023,5.0 of 5 stars,#33 of 372 hotels in Singapore,0.219,0.5800000000000001,60.95,58.00000000000001,21.9,Services
Pan Pacific Singapore,Amazing skills by ex mikuni chef,Food and services are excellent in Teppan counter by chef eric . His skills are amazing and we enjoy our dinner ultimately . Chef eric 30 years experience as Teppan chef since inagikh day now mikuni is authentic and fabulous . Thanks and we will definitely come back for more,5 out of 5,February 2023,5.0 of 5 stars,#33 of 372 hotels in Singapore,0.36,0.635,68.0,63.5,36.0,Services
Pan Pacific Singapore,great experience at edge,"food is great, seafood section is always filled and staff is attentive. Special mention to staff , Janice so friendly. staff are very attentive and ready to clear the empty plates when you leave your table Thank you for such a pleasant buffet dining experience :)",5 out of 5,February 2023,5.0 of 5 stars,#33 of 372 hotels in Singapore,0.35712301587301587,0.705952380952381,67.8561507936508,70.5952380952381,35.71230158730159,Services
Pan Pacific Singapore,Dinner,"Pleasant dining experience at Keyaki. Served by Jeff and Elsa, the Omakase sashimi plate recommended by Jeff is excellent, all ingredients are very fresh and tasty. Soft shell crab maki roll is good to try as well. Was here to celebrate 6-month anniversary and had a cake on the house. Environment is quiet and suitable for small group gathering. All in all a commendable Japanese dinner experience.",5 out of 5,February 2023,5.0 of 5 stars,#33 of 372 hotels in Singapore,0.35814814814814816,0.5611111111111112,67.9074074074074,56.11111111111112,35.81481481481482,Amenities
Pan Pacific Singapore,Great location with super comfy bed,Very comfortable big room with awesome views over marina bay. Staff were friendly and helpful. In room dining was fast efficient and tasty. Only negative in Feb 23 was the renovations which are needed but they impact some of the services like the hotel bar is temporarily closed,4 out of 5,February 2023,5.0 of 5 stars,#33 of 372 hotels in Singapore,0.211875,0.5875,60.59375,58.75,21.1875,Services
Pan Pacific Singapore,Outstanding Service and Good food,"I’m a frequent diner in Pan Pacific hotel and especially like their Chinese restaurant Hai Tien Lo. They have very good value for money weekend ala carte buffet and the tim sum n soups are delicious. However, what brings me back regularly is the outstanding service by the team there. They are attentive, personable, professional and always makes me feel like a VIP ! Kudus especially to Patrick and Michelle who always goes the extra mile n ensure my guests also receive excellent service which really impressed them. They are super client focused and knowledgeable and truly deserves merit. Special mention to the manager John as well who is always cheerful, friendly and attentive. Pan Pacific also has a very attractive Pan Pacific Privileges dining programme. It’s the best",5 out of 5,February 2023,5.0 of 5 stars,#33 of 372 hotels in Singapore,0.42383219954648527,0.6223818245246816,71.19160997732426,62.23818245246816,42.383219954648524,Services
Pan Pacific Singapore,Dinner at Keyaki,Good food and service staffs (Elsa and Lissie) Manager : Vincent friendly and gave good adv / recommendations! Must try the botan shrimp sashimi where they fried the head to crispness. Price also reasonable as quality food.,4 out of 5,February 2023,5.0 of 5 stars,#33 of 372 hotels in Singapore,0.5375,0.5750000000000001,76.875,57.50000000000001,53.75,Services
Pan Pacific Singapore,Ideally placed for Marina Bay.,Did not get the balcony room we had previously requested. Have stayed at the Pan Pacific before but this time the amount of the atrium closed off due to renovations rather spoilt the ambience of the hotel. One thing I must mention is the one occasion we used the pool restaurant. We were the only people there which resulted in too much attention being given to us whilst we ate.,4 out of 5,February 2023,5.0 of 5 stars,#33 of 372 hotels in Singapore,-0.03833333333333333,0.3683333333333333,48.083333333333336,36.83333333333333,3.833333333333333,Amenities
Pan Pacific Singapore,"Great staff, poor front desk.","Food and staff excellent, Newley refurbished room 1901 was a joke. I would rate this room as perfect for a businessman travelling solo, but for a mature couple on a multi centre holiday finishing their holiday of a lifetime this tiny room was totally unsuitable and disappointing . The coffee machine had more room space than the tiny wardrobe, which was 30cm wide which also held an ironing board plus hotel dressing gowns.Also a total lack of drawers etc which resulted in our possessions being spread around the room on any flat area.",3 out of 5,February 2023,5.0 of 5 stars,#33 of 372 hotels in Singapore,0.17045454545454544,0.5750000000000001,58.52272727272727,57.50000000000001,17.045454545454543,Value
Pan Pacific Singapore,An old friend in Singapore.,"We have stayed here on and off since the hotel was built 30 years ago. It has a great position, fantastic club lounge with views and a great staff looking after you. I think the refurbished rooms have been done on the cheap; I preferred the original design. The beds are very good though. That said I have stayed here three times within the last three months. All in all, I like this hotel.",5 out of 5,February 2023,5.0 of 5 stars,#33 of 372 hotels in Singapore,0.5264285714285714,0.6709523809523809,76.32142857142856,67.09523809523809,52.64285714285714,General
Pan Pacific Singapore,Perfect location,"Everything was exceptional, apart from the renovations. We had to switch rooms as the newer renovated rooms have a musty/moldy smell. However, they accommodated us and even gave us complimentary services. The staff are great and go out of their way. Friendly and very nice. Big kudos to TJ and Mira at reception/concierge. And to Janice at the edge, so sweet and bubbly!! They are perfectly located. Central to everything.... everything is about 20-30 minutes away by foot. And MRT stations (subway) are close by and so easily accessible. I would definitely go back :)",4 out of 5,February 2023,5.0 of 5 stars,#33 of 372 hotels in Singapore,0.4452951388888889,0.59375,72.26475694444444,59.375,44.529513888888886,Services
Pan Pacific Singapore,Revisit,"A revisit to Pan Pacific for further sightseeing following our last trip 3 years ago, sadly the weather had other ideas, so much rain! Harbour Studio suite on floor 33 with fabulous views across the bay was very spacious, clean and comfortable, plentiful Balmain toiletries and fluffy towels. Best of all was access to the club on floor 38, this absolutely made our holiday and put some sparkle into the rainy days, literally, champagne breakfasts and champagne again with the evening canapes. The food was divine, exquisitely presented, my favourite breakfast was the lobster eggs Benedict. Service was fabulous too throughout the hotel, poolside and front desk, we were given access to a hospitality room before our nighttime flight which was much appreciated., Had a great time,",5 out of 5,February 2023,5.0 of 5 stars,#33 of 372 hotels in Singapore,0.2583333333333333,0.5583333333333332,62.916666666666664,55.83333333333332,25.83333333333333,Amenities
Pan Pacific Singapore,Hai Tien Lo dining,Hai Tien Lo serves excellent food and having great and friendly staff Paulyn who guides us through the menu and recommended great dishes. Attentive and took care of us throughout the dining time. We absolutely enjoyed her hospitality and assistance . Looking forward to return for another great experience. Great job and million thanks Paulyn!,5 out of 5,February 2023,5.0 of 5 stars,#33 of 372 hotels in Singapore,0.6361111111111111,0.7,81.80555555555556,70.0,63.61111111111111,Services
Pan Pacific Singapore,Nice food and service restaurant,"Great food and service at Hai Tien Lo @Pan Pacific. Impressed by the prawns, little buddha jump soup and osmantha chicken. Our server, Pauline provided great service throughout our meals and was very helpful.",5 out of 5,February 2023,5.0 of 5 stars,#33 of 372 hotels in Singapore,0.3354166666666667,0.7083333333333334,66.77083333333333,70.83333333333334,33.54166666666667,Services
Pan Pacific Singapore,Home away from home,"I was a memorable stay for 2weeks. . Everyone has been accommodating from the receptionist, concierge, bellhop, room and dining services. I love how I start my mornings with the energy and friendly welcome of Janice at the Edge.",5 out of 5,February 2023,5.0 of 5 stars,#33 of 372 hotels in Singapore,0.54375,0.75,77.1875,75.0,54.37499999999999,Services
Pan Pacific Singapore,Excellent Return to Singapore,"We have just returned from a 2 month stay in the Pan Pacific, (our 4th visit since 2018). We would like to say a huge thank you to Shine, Club Lounge Manager at Pan Pacific and her excellent, professional team. They welcomed us each day from breakfast to evening cocktails. It was a pleasure to be there and we enjoyed their conversations, catching up with the staff that had been there since our first visit and getting to know new staff. We very much enjoyed the 360 degree views from the 38th floor of the club lounge, the food, the luxury decor and the relaxing atmosphere - let's hope it always remains this way and we have many more visits to look forward to.",5 out of 5,February 2023,5.0 of 5 stars,#33 of 372 hotels in Singapore,0.4486363636363636,0.6087878787878788,72.43181818181819,60.878787878787875,44.86363636363636,Services
Pan Pacific Singapore,Excellent,"Very comfortable hotel in the CBD. Really helpful staff - thank you to the Concierge who found us a restaurant (and a taxi on a rainy night) after a late arrival and to chef Nimo who guided us around the breakfast offerings to show what was gluten free, and then went the extra mile by specially preparing gluten free dhosa. The breakfast choice is the best I have ever seen in any hotel - just look on YouTube. We would return if in Singapore.",5 out of 5,February 2023,5.0 of 5 stars,#33 of 372 hotels in Singapore,0.3221428571428572,0.5464285714285714,66.10714285714285,54.64285714285714,32.214285714285715,Value
Pan Pacific Singapore,One of my best champagne lunch in SG,The food selections are great with good quality of food. Lobster and oyster always be refill not like other places. My champagne glass always never be empty. Staffs are really helpful. My table served my Janine … she is super detail for us. Worth for money and time.,5 out of 5,February 2023,5.0 of 5 stars,#33 of 372 hotels in Singapore,0.3011904761904761,0.455952380952381,65.0595238095238,45.5952380952381,30.119047619047613,Services
Pan Pacific Singapore,Not quite lived up to the dream,"We had a deluxe room which was ok if you were only staying one night 2 at the max ,there was very little storage .we had to put clothing in piles on seating as there was very little hanging space and draws.Food and staff at the Edge restaurant was excellent only gripe was air conditioning that was rather cold.",4 out of 5,February 2023,5.0 of 5 stars,#33 of 372 hotels in Singapore,0.12656250000000002,0.8374999999999999,56.32812499999999,83.74999999999999,12.656250000000002,Value
Pan Pacific Singapore,The Edge Restaurant Pan Pacific,Lunch today st The Edge is awesome due to the excellent hospitality of one of the service crew by the name of Janice. Thank you Janice for arranging the cake as well as taking care of our needs throughout the lunch.,5 out of 5,February 2023,5.0 of 5 stars,#33 of 372 hotels in Singapore,0.625,0.7916666666666666,81.25,79.16666666666666,62.5,Services
Pan Pacific Singapore,Clear-sighted choice for travelling to Singapore,"I had stayed in this hotel for total 4 nights This hotel provides full of amendities and belongings - This hotel is very close to the centre of Singapore, it only takes us 10-15mins by car to get to the merlion - Besides, this hotel also links to one big mall which locates in second floor - Furthermore, this hotel has the first floor to the third floor which access guests to various restaurant( Hai Tien Lo - chinese course menu restaurant, Edge- breafast buffet, Kaiyaki - Japanese restaurant, …) - There also has marketplace for tourists - Moreover , there is another mall ( total 2 big mall near this hotel) opposite this hotel - Staffs in here are very friendly, caring and helpful - Price is reasonable due to luxurious hotel But - Check-in Procedure took long time, we",4 out of 5,February 2023,5.0 of 5 stars,#33 of 372 hotels in Singapore,0.0743421052631579,0.35833333333333334,53.71710526315789,35.833333333333336,7.43421052631579,Location
Pan Pacific Singapore,Best Teppanyaki experience at Keyaki Restaurant,"First time at Keyaki and we have had the best Teppanyaki we ever tasted. We would like to compliment chef Eric Yong for his excellent culinary skills. The food coupled with the fresh ingredients, tasted so good, especially the Wagyu beef! Chef Eric would make the effort to ask for your food preference and cook the food according to your liking. Will definately recommend my friends to look for him and we will also be back soon for our next meal with him! :)",5 out of 5,February 2023,5.0 of 5 stars,#33 of 372 hotels in Singapore,0.375,0.47333333333333333,68.75,47.333333333333336,37.5,Amenities
Pan Pacific Singapore,Dinner@keyaki,"Got the 天 teppanyaki set meal for 2. Overall, the service was good, the food was okay (for the price we are paying) but the surrounding was beautiful. Waited a little longer for the garlic fried rice but overall a pleasant experience. The Fugu is a recommended item.",4 out of 5,February 2023,5.0 of 5 stars,#33 of 372 hotels in Singapore,0.3708333333333333,0.5095238095238096,68.54166666666667,50.95238095238096,37.08333333333333,Amenities
Pan Pacific Singapore,2nd honeymoon st Pan Pacific Singapore,"The hotel is just brilliant. We were in room 2515. Superb views and very very nice. We ate breakfast at the Edge restaurant and had two dinners there. Service is just about the best ever and the food is to die for. Last night we were looked after by Rose, who could not have been more helpful. Yes, thank you Rose for being to happy and efficient. We were here for five a night stay. It really was superb. Thank you Pan Pacific.",5 out of 5,February 2023,5.0 of 5 stars,#33 of 372 hotels in Singapore,0.6709090909090908,0.7242424242424242,83.54545454545455,72.42424242424242,67.09090909090908,General
Pan Pacific Singapore,Pacific bar lounge,Enjoyed so much on champagne breakfast and beautiful scenery with good memories on the cocktails prepared by Tom on Valentines Day. The food quality is excellent and the services are very professional. Will choose to stay on this hotel in future.,5 out of 5,February 2023,5.0 of 5 stars,#33 of 372 hotels in Singapore,0.4828571428571428,0.5364285714285714,74.14285714285714,53.64285714285714,48.285714285714285,Amenities
Pan Pacific Singapore,Master Teppenyaki Head Chef,"Great Master Chef, Tommy Yeo Very friendly and cooks excellent food. Highly Recommended. Nice ambience. Try the Teppanyaki at counter for best experience Would recommend the Wagyu Beef and Lobster as well as Japanese Snow Pork Also compliments to Suresh for great service as well as giving us a birthday cake. Thank you, Tommy and Suresh",5 out of 5,February 2023,5.0 of 5 stars,#33 of 372 hotels in Singapore,0.6059375,0.62375,80.296875,62.375,60.59375,Amenities
Pan Pacific Singapore,Excellent on every level!,"This hotel was chosen for us by our tour company, but we were so pleased in every respect. Check in and check out we’re both efficient and quick. The door staff were helpful with our luggage. There is building work continuing in the foyer area, but this is limited to daytime, and did not impinge on our stay. I just wish I could have seen it without the shrouds, because it’s a stunning building inside and out. The room was comfortable, clean, with an amazing view. The bed was wonderful! The breakfast was the most eclectic I have ever experienced. Service was friendly and efficient. Any type of breakfast was available, freshly cooked, and wonderfully tasty. The hotel has a very well equipped gym, although we didn’t use it, and the pool area is well serviced, clean, and",5 out of 5,February 2023,5.0 of 5 stars,#33 of 372 hotels in Singapore,0.4731398809523809,0.6776785714285715,73.65699404761905,67.76785714285715,47.31398809523809,General
Pan Pacific Singapore,Great teppanyaki,The beef fillet was sooo delicious! Enjoyed the special lobster sauce that the chef made. Love it! Chef Eric Yong was very experience and friendly. Service crew Suresh was helpful and professional. Thank you for the lovely lunch experience.,5 out of 5,February 2023,5.0 of 5 stars,#33 of 372 hotels in Singapore,0.4571428571428572,0.5651785714285714,72.85714285714286,56.51785714285714,45.714285714285715,Amenities
Pan Pacific Singapore,Wonderful Teppanyaki @ Keyaki,Nice 0lace with good ambience. Great food served by a very friendly chef Eric Yong with his special Teppanyaki sauce. Great place for couple to chill and enjoy a great dinner. Had a wonderful dinner here.,5 out of 5,February 2023,5.0 of 5 stars,#33 of 372 hotels in Singapore,0.660515873015873,0.7301587301587301,83.02579365079366,73.01587301587301,66.0515873015873,Amenities
Pan Pacific Singapore,Nice places for family gatherings,"Have a wonderful dinner in The Edge restaurant with my family together. The seafood snow crab legs and oyster was stunning at the night. Also, very nice and heartwarming service from the manager Ms Crystal and staff Rose. They have been very nice to offer babychair for our kids and keep asking if we need any helps. Definitely would bring my family back again.",5 out of 5,February 2023,5.0 of 5 stars,#33 of 372 hotels in Singapore,0.5228571428571429,0.7785714285714286,76.14285714285714,77.85714285714286,52.28571428571429,Services
Pan Pacific Singapore,Wonderful dining experience,"Celebrated my birthday here at Keyaki with my friend! It was a terrific experience, the food is super yummy and staff are all so warm and friendly! Exceeded our dining experience and much more! Special mention to Chef Eric Yong for the delicious teppanyaki and also all the little touches that made our dinning experience wonderful! Also would like to recommend chef Tommy Yeo’s wonderful garlic fried rice! Not forgetting the operation manager Vincent Yaw for arranging our fantastic dining experience and specially arranging the birthday cake! Lastly thank you server Suresh for the warm hospitality that completes this out of the world dining! We will 10/10 recommend and back for more!",5 out of 5,February 2023,5.0 of 5 stars,#33 of 372 hotels in Singapore,0.46209733893557425,0.6309523809523809,73.10486694677871,63.095238095238095,46.20973389355743,Amenities
Pan Pacific Singapore,Relaxing and Pampered.,"Looked after us well, great choice of breakfast items and if you have it in the Pacific Club you get champagne as well. Again afternoon tea with great cakes, and in the evenings champagne and cocktails plus canapés from 1800 - 2000 all with great veiws from the bar on the 38 floor.",5 out of 5,February 2023,5.0 of 5 stars,#33 of 372 hotels in Singapore,0.8000000000000002,0.75,90.00000000000001,75.0,80.00000000000001,Amenities
Pan Pacific Singapore,An unforgettable teppanyaki night! 🤣,Caroline and l (Michael) celebrated our 9th wedding anniversary with a teppanyaki dinner at Keyaki Restaurant in the Pan Pacific Hotel and our chef was Eric Yong. His service and food was outstanding. An unforgettable night. Thanks a million Eric! 👍,5 out of 5,February 2023,5.0 of 5 stars,#33 of 372 hotels in Singapore,0.475,0.70625,73.75,70.625,47.5,Services
Pan Pacific Singapore,Excellent chef 5 stars,Excellent chef Eric Yong. Food was superb. We love the sirloin beef the most. Very succulent and juicy! Chef was also very friendly and chatted with us during the dinner. A very lovely dinner and a great experience. Highly recommended 👌,5 out of 5,February 2023,5.0 of 5 stars,#33 of 372 hotels in Singapore,0.5941666666666667,0.7016666666666667,79.70833333333334,70.16666666666667,59.41666666666667,Amenities
Pan Pacific Singapore,Great dining experience,"Our birthday lunch + pre-CNY celebration at Hai Tien Lo exceeded our expectation. Ambience was good, food was delicious (love the dimsum variety & the lo hei) and Paulyn whom was our server was very attentive, patient & helpful with our requests.",4 out of 5,February 2023,5.0 of 5 stars,#33 of 372 hotels in Singapore,0.68,0.8,84.00000000000001,80.0,68.0,Services
