hotelname,title,desc,reviewRatings,reviewDate,hotelClass,hotelRank,polarity,subjectivity,Normalized_Polarity,Normalized_Subjectivity,Normalized_Polarity_POS_NEG,Category
Pan Pacific Singapore,"Great stay, with exceptional service","I don’t normally write reviews but after my excellent experience at the pan pacific I was compelled to write about my experience. I was in Singapore for a quick 4 day work trip, I don’t normally stay at the Pan Pacific but it was last minute so I booked here. From checkin to checkout the staff at hotel made my experience super smooth and memorable. To start, on checkin the lady at the front desk was kind enough to upgrade my room when they ran out of king beds, a really nice gesture given I was very jet lagged from the trip. Throughout the stay the staff was helpful and friendly. The rooms themselves are comfortable and the location very central. I couldn’t not recommend the pan pacific more. Thanks to all the staff for making the experience as smooth as possible!",5 out of 5,June 2023,5.0 of 5 stars,#33 of 372 hotels in Singapore,0.3232456140350878,0.6083333333333334,66.16228070175438,60.83333333333334,32.32456140350878,Services
Pan Pacific Singapore,Great staff attitude ......,The stay is excellent.Also the staff JunYun who is handling the dragon boat nonya dumplings is extremely helpful......i personally went back for more after the 26 june which is after the festival.he managed to get 10 more for me for my family members who are coming in from Perth and have not eaten thr dumplings for ages.,5 out of 5,June 2023,5.0 of 5 stars,#33 of 372 hotels in Singapore,0.175,0.45999999999999996,58.75,46.0,17.5,Services
Pan Pacific Singapore,Service excellence coupled with great food,"Edge is a great place to gather for a meal with friends or family. Good variety of cuisine types. Pretty large range. Customer service was really good. A server that I would like to highlight is Shasha. She has a cheerful disposition and was eager to see to our needs. She anticipated our needs and was there to help us with our requests. A lovely, warm and cheerful lady even though our group was always asking for one thing or another. A true show of excellent and professional customer service.",5 out of 5,June 2023,5.0 of 5 stars,#33 of 372 hotels in Singapore,0.5011904761904761,0.706547619047619,75.05952380952381,70.6547619047619,50.119047619047606,Services
Pan Pacific Singapore,Good service at Hai Tien Lo,"Food at Hai Tien Lo was good and the service staff very professional. Shout out to Genevieve, Samuel, Xiao Lin and Apple. Great ambience too. All my guests like the foid, its presentation and the attentiveness of the wait staff.🙂",4 out of 5,June 2023,5.0 of 5 stars,#33 of 372 hotels in Singapore,0.5433333333333333,0.49333333333333335,77.16666666666667,49.333333333333336,54.333333333333336,Services
Pan Pacific Singapore,"Fantastic buffet lunch at Edge, Pan Pacific","Best buffet lunch in town, good spread of salad, fish n beef n good pork ribs. Great Indian food n Roast meats n laksa.New menu of Thai cuisine too. Nice desserts . We were there a group of 6 celebrating a Birthday. On 23 june. We were very well served by Sally Koh who was very knowledgable n friendly n the whole team provide great service, special mention Grace who attended to our table",5 out of 5,June 2023,5.0 of 5 stars,#33 of 372 hotels in Singapore,0.5392857142857143,0.551948051948052,76.96428571428571,55.1948051948052,53.92857142857142,Amenities
Pan Pacific Singapore,Wonderful dining experience at The Edge,"Excellent service rendered by Rose from the Edge. Rose was highly professional, serve with a smile and goes the extra mile in ensuing that our needs are well taken care of. Special thanks to Ying as well for rendering excellence service to our family.",5 out of 5,June 2023,5.0 of 5 stars,#33 of 372 hotels in Singapore,0.3946428571428572,0.49642857142857144,69.73214285714286,49.642857142857146,39.464285714285715,Services
Pan Pacific Singapore,SHASHA IS AWESOME!!,"Shasha is an amazing waitress!! I like her attitude and tone, it’s super awesome and entertaining. She’s super friendly and nice, I like the way she always smiles and looks like she’s enjoying her job! It makes me feel happy and welcomed! Overall one of the bestest waitress I have encountered yet! Such a nice person, I hope to meet more people like her!",5 out of 5,June 2023,5.0 of 5 stars,#33 of 372 hotels in Singapore,0.5330128205128205,0.6948717948717948,76.65064102564104,69.48717948717949,53.30128205128205,Services
Pan Pacific Singapore,Best service,"Excellent! The food is delicious! Manager and chef are friendly and helpful. The staff/waiter Ms Shasha and Ms Rose are very helpful. We requested for birthday cake, less than 5 minutes she prepare the cake and help us celebrate the birthday!",5 out of 5,June 2023,5.0 of 5 stars,#33 of 372 hotels in Singapore,0.49444444444444446,0.6361111111111112,74.72222222222223,63.61111111111112,49.44444444444444,Services
Pan Pacific Singapore,A wonderful dinner for regular guests of Hai Tien Lo,I find one of your serving waiter Patrick Tan who is experienced in recommending unique dishes to us so that we not feel bored since we are regular to Hai Tien Lo.. He is patient and also polite during his service despite my 2 elderly seniors .. keep up the good work,5 out of 5,June 2023,5.0 of 5 stars,#33 of 372 hotels in Singapore,0.275,0.7153846153846154,63.74999999999999,71.53846153846153,27.500000000000004,Services
Pan Pacific Singapore,good buffet place,Venga was extremely friendly and polite. He went for the extra mile to serve us to ensure are needs and wants are met. Good buffet place to dine in and friendly staff! Would recommend this place for everyone,5 out of 5,June 2023,5.0 of 5 stars,#33 of 372 hotels in Singapore,0.34875,0.36,67.4375,36.0,34.875,Services
Pan Pacific Singapore,Edge buffet and service,"Great hotel set up for longer business stays. Large rooms with good bedding and closet space. The absolute highlight was the breakfast and specifically the server - Sally. Sally fun and attentive, really going above to bond with us and make breakfast something to look forward to. Would recommend to future corporate clients purely on her service.",5 out of 5,June 2023,5.0 of 5 stars,#33 of 372 hotels in Singapore,0.2753246753246753,0.42759740259740264,63.76623376623376,42.75974025974026,27.532467532467532,Services
Pan Pacific Singapore,Food Service - good,"Warmed welcome by staff Sally, given us a 'introduction' tour for the lunch buffet. Very helpful. Commentable. Spacious sitting, has privacy for conversation. Attentive staff frequently visited table to remove food ware.",4 out of 5,June 2023,5.0 of 5 stars,#33 of 372 hotels in Singapore,0.375,0.6,68.75,60.0,37.5,Services
Pan Pacific Singapore,Plume’n good time,"Went to Plume, a cozy bar with cocktails inspired by the avifauna of SG. Served by Meur who whipped two solid cocktails up. Bar is relatively new at 3 months in but the bartenders carry the craft and maturity of a seasoned drinking hole. Cheers!",5 out of 5,June 2023,5.0 of 5 stars,#33 of 372 hotels in Singapore,0.06221590909090909,0.3886363636363636,53.11079545454545,38.86363636363636,6.221590909090909,Amenities
Pan Pacific Singapore,Great stay,The room was comfortable and spacious but lacked a real wardrobe. Bathroom was well appointed and all in all the hotel was lovely. A shuttle between City Hall MRT and the hotel would be a great addition.,5 out of 5,June 2023,5.0 of 5 stars,#33 of 372 hotels in Singapore,0.47500000000000003,0.65,73.75,65.0,47.5,Cleaniness
Pan Pacific Singapore,Business trip,"Rooms are comfortable and clean and some rooms come with a small balcony with great views to the marina. The breakfast buffet is excellent, choice and quality. Fresh fruit juices, eggs Benedict, yogurts, tasty pain aux chocolat, bee honey, and much more. The hotel is in walking distance to the promenade and connected to the mall as well. Check out is quick and uncomplicated. Only little downside was the gym, it could get an upgrade in size and variety of equipment.",5 out of 5,June 2023,5.0 of 5 stars,#33 of 372 hotels in Singapore,0.32625000000000004,0.665,66.3125,66.5,32.62500000000001,Amenities
Pan Pacific Singapore,Extremely disappointing!,"We had stayed here previously on two occasions and could hardly believe it was the same place! First impressions - reception was atrocious - dysfunctional, slow & inexperienced staff. We had booked a newly renovated deluxe club room - don't know who their architect was or what he was thinking. could only be appropiate for a single person staying overnight! It had hanging space ( not in wardrobe ) for about 5 items, no drawers, and room for one suitcase in storage area. We had booked 4 nights and were traveling overseas for over a month. After complaining we were assigned an older room which at least had wardrobe space and drawers - we were then left to our own devices, hopefully forgotten - nothing in bar fridge, no coffee or tea or milk, only supplied bottled water each day.",1 out of 5,June 2023,5.0 of 5 stars,#33 of 372 hotels in Singapore,-0.012161796536796561,0.5293019480519481,49.39191017316017,52.93019480519481,1.216179653679656,Services
Pan Pacific Singapore,Located near Marina Square and Suntec City,"Have stayed at this hotel for a few times. The hotel is currently undergoing renovation. Accessible to Marina Square, Suntec City and MBS. Love the bubble lift with view of the city area. The newly refurbished room is pretty nice. Great breakfast with many varieties.",5 out of 5,June 2023,5.0 of 5 stars,#33 of 372 hotels in Singapore,0.3290404040404041,0.5755050505050505,66.45202020202021,57.55050505050505,32.90404040404041,Amenities
Pan Pacific Singapore,Excellent,"Our trip was almost perfect, my only wish is that breakfast was included. The room and the rest of the hotel is clean and the staff were great. Location was close to everything. I won’t mind coming back to Pan Pacific Hotel for another wonderful experience.",5 out of 5,June 2023,5.0 of 5 stars,#33 of 372 hotels in Singapore,0.5277777777777778,0.7416666666666667,76.38888888888889,74.16666666666667,52.77777777777778,General
Pan Pacific Singapore,10 July 2023,"We had a really great time. Putra and Meor are amazing bartender and really fun to talk to. They made this experience extra special Would go again for sure Great cocktails, it was super fun to try the green ant gin cocktail",5 out of 5,June 2023,5.0 of 5 stars,#33 of 372 hotels in Singapore,0.3790476190476191,0.5326984126984127,68.95238095238095,53.269841269841265,37.904761904761905,Amenities
Pan Pacific Singapore,Great stay,Great hotel with extremely impeccable service and we were greatly taken care of by both Mariana and Siti during the duration of our stay. Room was spacious and clean with the only slight complaint being amenities were not always refilled.,4 out of 5,June 2023,5.0 of 5 stars,#33 of 372 hotels in Singapore,0.3214285714285715,0.6166666666666668,66.07142857142858,61.66666666666668,32.14285714285715,General
Pan Pacific Singapore,Worthless,We travel singapore 🇸🇬 to celebrate my birthday and tried too book best property and found pan pacific But unfortunately when we visited stayed found it not satisfactory 1st I requested for special request on my birthday celebration for a cake/or champagne staff denied for it on (1st july) they don’t bother even to wish 2nd I found rooms r very small there not even a proper space to keep luggage too and no space for extra bedding 3 service is very poor 4 higly overpriced 5 staff has to time to listen guests 6 indian food menu at breakfast is very limited and all day repeated same Overall money waste,1 out of 5,June 2023,5.0 of 5 stars,#33 of 372 hotels in Singapore,-0.023392857142857135,0.30684523809523817,48.830357142857146,30.684523809523817,2.3392857142857135,Value
Pan Pacific Singapore,A Phenomenal Stay at an Inviting Hotel,"I had a wonderful stay at the Pan Pacific. I love the ambiance of the hotel and the overall design of the lobby. The inviting seats in the Atrium, the exclusivity of the dining pods in the back, the transparent floor to ceiling elevators, and the calming vibes of the palm trees. My room was small but comfortable and had all the amenities I needed - plush slippers, TWG teabags, Nespresso machine, Balmain toiletries, and a great view of the city. Housekeeping was mostly consistent in replenishing towels, tea + coffee, and water (but not toiletries) and kept my room clean for the duration of my stay. There was initial confusion about whether or not breakfast was included in my package, but the manager at Edge was kind enough to comp me for the first breakfast buffet at Edge. I",5 out of 5,June 2023,5.0 of 5 stars,#33 of 372 hotels in Singapore,0.3012820512820513,0.4794871794871795,65.06410256410257,47.94871794871795,30.12820512820513,Amenities
Pan Pacific Singapore,Worst service,"Worst service ever had in a 5 star hotel. Room service simple plate, spoon and ice bucket waiting for last 1 hour. Location wise excellent. Oh I just got my order. Veiw feom room is good that didn't allow me to give 1 star.",2 out of 5,June 2023,5.0 of 5 stars,#33 of 372 hotels in Singapore,0.2333333333333333,0.653968253968254,61.66666666666667,65.39682539682539,23.333333333333332,Services
Pan Pacific Singapore,Great experience at Pan Pacific Singapore,"Perfect location near tourist spots, bus stops, and major shopping centers. It made exploring the city a breeze. The team created a home-like experience for us, and the personal touches were greatly appreciated. My daughter especially enjoyed the graduation welcome treat, which made us feel truly welcome. The Premier Marina Bay Room was fantastic, offering breathtaking views of Marina Bay and the Singapore skyline. The inner courtyard's majestic interiors added to the property's amazing design. The breakfast spread was irresistible, and we particularly loved the pastries and breakfast pizza. We left the table feeling delightfully satisfied and ready for the day. The dinner buffet at the Edge was a delightful treat, although we regret not being able to dine at Keyaki as we had",5 out of 5,June 2023,5.0 of 5 stars,#33 of 372 hotels in Singapore,0.49236111111111114,0.6662037037037039,74.61805555555556,66.62037037037038,49.236111111111114,Location
Pan Pacific Singapore,Great views,A lovely hotel to stay in. We had a marina bay view and the rooms were a good size. The club upstairs has great views and Sharon who works there really looked after us. The only thing we would change would be at the arrival and departure we weren’t helped with our luggage and our taxi driver even commented on this.,4 out of 5,June 2023,5.0 of 5 stars,#33 of 372 hotels in Singapore,0.44000000000000006,0.66,72.0,66.0,44.00000000000001,General
Pan Pacific Singapore,Great experience,Very clean hotel and the staff is very friendly and eager to assist. The check in and check out queuing is very time consuming although they have someone asking the queuing guests if they can assist in other enquiries. The rooms is beautiful and the beds is out of this world. The rates to me is way too high but again not much higher than other hotels in the area.,4 out of 5,June 2023,5.0 of 5 stars,#33 of 372 hotels in Singapore,0.22489583333333335,0.58125,61.244791666666664,58.12500000000001,22.489583333333336,Services
Pan Pacific Singapore,"Good Hotel, Good Location , its good for Family vacation","This hotel service is very good, the location is very good, close to the MRT station, close to Marina Bay. Highly recommended for a family hotel in Singapore, The swimming pool is quite good for children, although for adults it is a bit too shallow.",5 out of 5,June 2023,5.0 of 5 stars,#33 of 372 hotels in Singapore,0.46933333333333327,0.64,73.46666666666665,64.0,46.93333333333333,Amenities
Pan Pacific Singapore,Stay at Pan Pacific Singapore,"Pan Pacific Singapore is very close to everything. I really recommend it if you are traveling alone. Staff is so nice. Rooms are clean and provide many amenities. You have many options of restaurants, pool is really good. I will come back.",5 out of 5,June 2023,5.0 of 5 stars,#33 of 372 hotels in Singapore,0.3833333333333333,0.47500000000000003,69.16666666666667,47.5,38.33333333333333,Amenities
Pan Pacific Singapore,I dont recommend for those look for details and quality,"Rooms and corridors are smelling mold most probably because of very old building Extremely careless staff No hospitality sense at all Nice location,connected with a shopping mall. I dont think i will come again",3 out of 5,June 2023,5.0 of 5 stars,#33 of 372 hotels in Singapore,0.1825,0.665,59.12500000000001,66.5,18.25,Cleaniness
Pan Pacific Singapore,A solid business hotel stay,"Pan Pacific is a solid hotel that’s in the process of a positive upgrade. It’s focus is very clearly on the business traveller. The rooms are well appointed and fairly big l, as it’s an older hotel, and the ground floor revamp is showing that it’s still a quality location and stay. Room improvements in decor, especially club level rooms, would be a good change, but it’s otherwise a very clean and comfortable hotel in a good central location. Breakfast is vast in terms of options and it’s all good quality. Staff are friendly and professional.",4 out of 5,June 2023,5.0 of 5 stars,#33 of 372 hotels in Singapore,0.2650404040404041,0.5291414141414141,63.25202020202021,52.91414141414141,26.504040404040406,General
Pan Pacific Singapore,Expected more.,"My first visit to Singapore and first ever stay in a Pan Pacific Hotel so I was really looking forward to my 3 night stay after 13 nights island hopping around Indonesia. First impressions were good, check in was faultless and we were up in our room in no time. The room was great, very spacious, great bathroom with amazing shower and the bed was very comfortable, with a city view over Singapore skyline. I noticed on my first morning that the duvet was torn, we hadn’t done it and thought housekeeping would change it as it was quite frayed, but no the room was serviced and bed made up with torn duvet, not great for a supposedly 5* hotel. On our last day the duvet was eventually changed but we were left with only one robe and no hand soap, but a vanity box and clothes brush",3 out of 5,June 2023,5.0 of 5 stars,#33 of 372 hotels in Singapore,0.33875,0.5406249999999999,66.9375,54.06249999999999,33.875,Location
Pan Pacific Singapore,Great experience at The Edge,"My husband and I celebrated our 40th wedding anniversary with a dinner at Pan Pacific’s The Edge buffet and we had such an enjoyable and pleasant experience. We were served by Xylyn and her hospitable and professional service elevated our special evening. She was attentive and thoughtful, and we thoroughly enjoyed the impeccable service and food. I’d highly recommend The Edge!",5 out of 5,June 2023,5.0 of 5 stars,#33 of 372 hotels in Singapore,0.39004329004329,0.6252813852813853,69.5021645021645,62.528138528138534,39.004329004329,Services
Pan Pacific Singapore,HoneyMoon trip,Overall it was a good experience and ambience for our honeymoon trip. We forgot to make a small request to set the room for our honeymoon such as swan pillows and red Rose petals lined up in heart shape.,4 out of 5,June 2023,5.0 of 5 stars,#33 of 372 hotels in Singapore,0.17499999999999996,0.4083333333333334,58.75,40.833333333333336,17.499999999999996,General
Pan Pacific Singapore,Great Experience!,Buffet was great. Sally had attended to us during lunch service today. Sally's service is very nice and friendly! The buffet spread was good and fresh. I will definitely recommend all to come and visit this establishment.,5 out of 5,June 2023,5.0 of 5 stars,#33 of 372 hotels in Singapore,0.508125,0.6416666666666667,75.40625000000001,64.16666666666667,50.81250000000001,Amenities
Pan Pacific Singapore,Excellent 5 star hotel with a Club Pacific room and access to the 39th floor Club Lounge,"We stayed in a Pacific Club room. A great experience with very large well equipped rooms, free soft drinks in the mini bar, excellent range of food in the top floor Club lounge. Close to major shopping centres and eateries",5 out of 5,June 2023,5.0 of 5 stars,#33 of 372 hotels in Singapore,0.4487244897959184,0.636734693877551,72.43622448979592,63.6734693877551,44.87244897959184,Amenities
Pan Pacific Singapore,The Edge Buffet Restaurant,"Visited The Edge buffet restaurant in Pan Pacific. Had the best birthday celebration with our group of friends. One of the waitress, Shasha had definitely make our day even wonderful. She had been so patience with us for our indecisive decision of whether to take up the unlimited beverages package and help us with all enquires & request. Thank you so much and keep it up. I will definitely re-visit The Edge.",5 out of 5,June 2023,5.0 of 5 stars,#33 of 372 hotels in Singapore,0.44000000000000006,0.5,72.0,50.0,44.00000000000001,Services
Pan Pacific Singapore,Efficient and friendly staff,"Lovely hotel well located with great service. Staff are attentive and efficient. Breakfast at the edge is great with a big choice in cuisine. Connected to the Marina Mall and the Ritz Carlton hotel. Walking distance from the sands convention center where our meetings were held and very convenient. Easy access to Suntel mall with many dining options, fountain of wealth and shops.",5 out of 5,June 2023,5.0 of 5 stars,#33 of 372 hotels in Singapore,0.3925925925925926,0.5537037037037037,69.62962962962963,55.37037037037037,39.25925925925926,Location
Pan Pacific Singapore,Keyaki,"Remembered many good things about Keyaki from decades ago. Great, attentive service by Chef Tommy Yeo, who took care of the whole family. Proactive, entertaining and understanding. Keep it up. Thank you. We will be back!",5 out of 5,June 2023,5.0 of 5 stars,#33 of 372 hotels in Singapore,0.4428571428571429,0.5499999999999999,72.14285714285714,54.99999999999999,44.28571428571429,Services
Pan Pacific Singapore,Great birthday celebration at Keyaki,"I brought my parents to Keyaki for my Mum's birthday celebration. We were served by Jeff and Nicole, who were extremely friendly and attentive. Jeff was also a great photographer - we left the restaurant with many nice pictures of the celebration and memories. Thanks Keyaki team for the hospitality!",5 out of 5,June 2023,5.0 of 5 stars,#33 of 372 hotels in Singapore,0.41785714285714287,0.55,70.89285714285715,55.00000000000001,41.785714285714285,Services
Pan Pacific Singapore,Excellent Hotel,"The Hotel was excellent , very clean and the location was the best. Near to most interesting places. The breakfast included everything and it was one of the most tasteful breakfast which we had. The staff was polite and friendly. When we travel again to Singapore this will be again our hotel!!",5 out of 5,June 2023,5.0 of 5 stars,#33 of 372 hotels in Singapore,0.5828255208333333,0.5762499999999999,79.14127604166666,57.62499999999999,58.28255208333333,General
Pan Pacific Singapore,Birthday Staycation,Upon arrival room wasn’t ready which wasn’t big issue cos we were going out anyway.. but then after we came back found issue with the lift .. we were trying to go to the club lounge but the lift only went up to 33floor and not 38 floor club lounge and then went down to 1st floor and up again and delayed our time for afternoon tea. Upon arrival to the room the minibar was locked and extra bed that we requested was not sent up. Birthday decorations could be improved,3 out of 5,June 2023,5.0 of 5 stars,#33 of 372 hotels in Singapore,0.007407407407407404,0.33148148148148154,50.37037037037037,33.14814814814815,0.7407407407407405,Services
Pan Pacific Singapore,Wonderful Pan pacific moment,"In room dining experience was great. The staff by the name of Niroshan, who serve me my in room dining meal was friendly and helpful. Always having a smile on him. Club lounge at level 38 was on another level of greatness. Their view was awesome, food and drinks were great as well. Staff also displayed pleasant and great service with a smile on them all the time. Breakfast at Edge restaurant was awesome, offering a wide variety of food and drinks. Me and my family has a great morning breakfast moment.",5 out of 5,June 2023,5.0 of 5 stars,#33 of 372 hotels in Singapore,0.618939393939394,0.6424242424242425,80.9469696969697,64.24242424242425,61.8939393939394,Services
Pan Pacific Singapore,Must stay,Outstanding Hotel with great connectivity to everything i needed Great Breakfast Wonderful Bar Supercool pool Room were superb Must visit for business and leisure travellers and experience the hotel at its best,5 out of 5,June 2023,5.0 of 5 stars,#33 of 372 hotels in Singapore,0.85,0.7791666666666667,92.5,77.91666666666667,85.0,Amenities
Pan Pacific Singapore,Great food,"Tommy served up a delightful Kaze meal for us, while Suresh was excellent in his service throughout. Tommy has great experience working in hotels and also internationally, and it shows through his food",5 out of 5,June 2023,5.0 of 5 stars,#33 of 372 hotels in Singapore,0.7,0.6875,85.0,68.75,70.0,Amenities
Pan Pacific Singapore,Great all round package & experience,"Great venue ,great food & great service. . Good Gym will definitely return Pool was a bit warm for my liking members lounge exceeded expectations for service & quality . Bed was huge .We stayed on the 35 floor with exceptional views",5 out of 5,June 2023,5.0 of 5 stars,#33 of 372 hotels in Singapore,0.5958333333333334,0.7312500000000001,79.79166666666667,73.125,59.58333333333334,Amenities
Pan Pacific Singapore,Great experience!,Tommy Yeo was very friendly and attentive to our needs! Food was very tasty and it was an enjoyable experience. We were celebrating a family occasion and the service staff went above and beyond for us.,5 out of 5,June 2023,5.0 of 5 stars,#33 of 372 hotels in Singapore,0.3375,0.51,66.875,51.0,33.75,Services
