hotelname,title,desc,reviewRatings,reviewDate,hotelClass,hotelRank,polarity,subjectivity,Normalized_Polarity,Normalized_Subjectivity,Normalized_Polarity_POS_NEG,Category
Pan Pacific Singapore,Sublime view,"This hotel is handy for Downtown and the MRT but its star attraction is the sublime view over Marina Bay. We stayed in a Pacific Club Harbour room on the 33rd floor and the club lounge on the 38th has an even more impressive 360° view of the city and strait over to Indonesia. The lounge hosts were friendly and very capable, many working both morning and evening. Afternoon tea was available 2 till 4 pm, followed by substantial canapés and free-flowing drinks 6 till 8 pm. Breakfast for club guests was served in separate area of the main restaurant, with a vast choice of western and Asian dishes and champagne if desired. A couple of small let-downs: Firstly, while both our room and public areas were generally clean, there were occasional lapses (eg glasses not washed) that one",4 out of 5,October 2022,5.0 of 5 stars,#33 of 372 hotels in Singapore,0.2605208333333333,0.45489583333333333,63.026041666666664,45.489583333333336,26.052083333333332,Amenities
Pan Pacific Singapore,Top notch buffet in Singapore,Visited the edge buffet resto. Amazing selections with international flavours. Thumbs up to service personnel Shasha for her amazing warm hospitality. Also Raj for many of his assistance. Went for a birthday celebration! Thank you all for making it a happy moment for all our family members!,5 out of 5,October 2022,5.0 of 5 stars,#33 of 372 hotels in Singapore,0.5708333333333334,0.65,78.54166666666667,65.0,57.08333333333334,Services
Pan Pacific Singapore,Ruined stay by extensive refurbishment work,"Extensive building work to refurbish rooms and the bar area on the ground floor. The works is incredibly noisy, although restricted to 10AM-6PM. No advise when I booked, and I was still charged full rate for my room. There is no way these works should be happening in a 5* hotel when guests are present. No excuses. Checked out early because of the noise. I am also a discover titanium level member.",2 out of 5,October 2022,5.0 of 5 stars,#33 of 372 hotels in Singapore,0.27,0.4166666666666667,63.5,41.66666666666667,27.0,Value
Pan Pacific Singapore,Would Not Stay Again,"My concerns about my stay began when, months after booking my stay using the Discovery program, I received notification from the hotel of ongoing renovations to ""balcony"" suites. An e-mail to the address listed as the point of contact within this email was rejected and returned, and while I did receive a response from my second e-mail, it simply repeated exactly what was contained in the original e-mail and nothing more. Upon our arrival, we were placed in a room on the Club level (35th floor), which looked VERY little like the room that I had previewed on both the hotel and Discovery sites. The images and floor plan included a large (modern) tub with a large window/view of the outside, which was selected specifically for our arrival in Singapore following a 14 hour flight from",2 out of 5,October 2022,5.0 of 5 stars,#33 of 372 hotels in Singapore,0.1372564935064935,0.3467532467532467,56.862824675324674,34.67532467532467,13.725649350649348,Services
Pan Pacific Singapore,Edge is the best!,"Good variety of buffet spread. Food is great, seafood is fresh. Restaurant ambience is nice. Double boiled ginseng soup is nourishing. Excellent service from Steven, Nithya, Ros, Amy, Jeremy, Crystal, Peter and Matthew. Will visit Edge again.",5 out of 5,October 2022,5.0 of 5 stars,#33 of 372 hotels in Singapore,0.5666666666666667,0.6416666666666667,78.33333333333333,64.16666666666667,56.666666666666664,Amenities
Pan Pacific Singapore,Bad smell and musty linnen,"Unfortunately our stay at Pan Pacific Singapore was not a pleasant one. The quality of the room, especially room climate and smell, was not good at all. The rooms had a high humidity, beds and linnen felt unventilated and musty. Furthermore, there was a strong smell in the room, obviously from the drain system. There was also a strong mildew in the shower and toilet. Overall a bad experience.",1 out of 5,October 2022,5.0 of 5 stars,#33 of 372 hotels in Singapore,-0.08393939393939394,0.6127272727272728,45.8030303030303,61.27272727272728,8.393939393939394,Cleaniness
Pan Pacific Singapore,Scrumptious meal excellent service,"Had a great meal over at Hai Tien Lo with delicious dishes recommended by the ever attentive service team - John, Kelly and Apple. Highly recommend their roast chicken with its addictive chilli sauce, sliced fish soup that is very refreshing as well as the asparagus with lily bulb. Thoroughly enjoyed the session and looking forward to come back",5 out of 5,October 2022,5.0 of 5 stars,#33 of 372 hotels in Singapore,0.32333333333333336,0.7488888888888889,66.16666666666666,74.8888888888889,32.333333333333336,Amenities
Pan Pacific Singapore,Great Weekend Getaway!,"We had a lovely 3 night stay in Pan Pacific Singapore! It was my daughter's first overseas travel since pre covid and both hers and my husband's first time to SG. Prior to traveling I had read reviews that the lobby was under a major renovation so I had reached out to hotel to be in a quiet area. Upon arrival, check-in was quick and seamless and they placed us in a very high / quiet floor. We only heard noisy construction work about 30 mins of 1 day we were at the hotel and it didn't bother us! The rooms were so spacious and comfortable. This is my second time to stay in Pan Pacific and will probably stay there again on my next trip over! The location is great too!",5 out of 5,October 2022,5.0 of 5 stars,#33 of 372 hotels in Singapore,0.21525555555555556,0.42902222222222225,60.76277777777778,42.90222222222223,21.525555555555556,Location
Pan Pacific Singapore,None,"I made my booking for me and my family, a total of 3 rooms. I called directly to make the booking and there was no mention of the very noisy renovation. Furthermore, I asked that all three Harbor view rooms to be in the same floor and when my daughter checked in, much to her surprise, she was placed on a different floor. The rooms were very comfortable but the room housekeeping extremely late. This is the second time I stay in Pan Pacific and I am a Discovery Gold member.",3 out of 5,October 2022,5.0 of 5 stars,#33 of 372 hotels in Singapore,0.08,0.44166666666666665,54.0,44.166666666666664,8.0,Services
Pan Pacific Singapore,Great Team from Hai Tien Lo,"We had our wedding lunch at Hai Tien Lo. The team was friendly and never failed to reply to our queries even at night. Their prompt response was amazing. Not to forget, the food was delicious that all our guest love it. Good job Hai Tien Lo team. Thanks for making the day happen. =)",5 out of 5,October 2022,5.0 of 5 stars,#33 of 372 hotels in Singapore,0.515625,0.6375000000000001,75.78125,63.75000000000001,51.5625,Services
Pan Pacific Singapore,Construction place with bad service!,"The hotel is like a construction place, you can't rest or sleep. The walls are thin as paper, they don't inform the customers about the construction before you check in. This hotel should be kept closed during the rebuilt, the personnel has more or less zero service mind except the room service and luggage guys they are compensating for the reception. And if you like to spend 1 hour each day in the elevator, then it's the perfect hotel for you!",1 out of 5,October 2022,5.0 of 5 stars,#33 of 372 hotels in Singapore,0.16666666666666669,0.5033333333333333,58.333333333333336,50.33333333333333,16.666666666666668,General
Pan Pacific Singapore,"Hotel in renovation without warning - 'sorry, sorry', but no compensation","This undoubtedly 'high-class' hotel 'forgot' to mention when we were booking that they were renovating and that this would mean that we would hear the jack-hammer working in the rooms just below ours during the whole day! We arrived for our stay on Monday - the same day we were informed by an email of the renovations going on and the noise problems for the whole week. The email and the information at the check-in focused on the works going on at the first floor (just a bit annoying - we were on the 24th floor) but they forgot to stress the enormous jack-hammering noise coming from the works on the floors just below our room. When complaining, everybody said friendly 'very sorry', but no one could help us. A formal complaint to the hotel manager showing that other guests got a",2 out of 5,October 2022,5.0 of 5 stars,#33 of 372 hotels in Singapore,-0.10113636363636364,0.5291666666666667,44.94318181818182,52.916666666666664,10.113636363636363,Services
Pan Pacific Singapore,Wedding Banquet at Hai Tien Lo,"Had a wonderful & memorable wedding dinner banquet at Hai Tien Lo. Special thanks to John, Frankie, Apple & team for hosting & coordination of our wedding event! They were responsive to our requests throughout this journey & food is great!!",5 out of 5,October 2022,5.0 of 5 stars,#33 of 372 hotels in Singapore,0.6214285714285714,0.7042857142857143,81.07142857142857,70.42857142857143,62.142857142857146,Services
Pan Pacific Singapore,"2nd visit, and almost as good","Our second visit to this wonderful hotel, on the tail end of another trip to Thailand and Singapore. As ever, the staff were superb, hotel was awe inspiring with its architecture, and the buffet breakfast was huge in its diversity ( honestly! You want something, they’ve got it) Only downside was the room. The room itself was superb, huge, and great views over Singapore, but the musty, damp smell is why I gave 4* this time round. We couldn’t put our finger on what the issue was, nor could we find the cause of it. Otherwise, love this hotel, it’s staff and it’s location.",4 out of 5,October 2022,5.0 of 5 stars,#33 of 372 hotels in Singapore,0.5125000000000001,0.7875,75.62500000000001,78.75,51.25000000000001,Services
Pan Pacific Singapore,"Good food, atmosphere and experience",We were served by chef Tommy Yeo at the teppanyaki counter. He is friendly and provided his recommendations on the menu. Throughout the meal he made small talk and ensure our needs are met. We thoroughly enjoyed our experience with him as our chef.,5 out of 5,October 2022,5.0 of 5 stars,#33 of 372 hotels in Singapore,0.20833333333333334,0.5333333333333333,60.416666666666664,53.333333333333336,20.833333333333336,Services
Pan Pacific Singapore,Good service rendered by Tommy Yeo @Keyaki,Went Keyaki to celebrate my anniversary with husband. Had a wonderful experience and the teppanyaki chef Tommy was friendly and professional. Recommend this place for food as the food is nice. Will come back again.,5 out of 5,October 2022,5.0 of 5 stars,#33 of 372 hotels in Singapore,0.41500000000000004,0.52,70.75,52.0,41.5,Amenities
Pan Pacific Singapore,Great Saturday brunch,"It was great. We had a lot of fun, especially our waiter steven, was very nice. Highly recommended! If you are looking for great seafood you are definitely at the right place. Make sure to do the full champagne package Good food. Happy wife happy life.",5 out of 5,October 2022,5.0 of 5 stars,#33 of 372 hotels in Singapore,0.48582417582417575,0.7165079365079365,74.29120879120879,71.65079365079366,48.58241758241758,Amenities
Pan Pacific Singapore,Honeymoon - short stay,Our stay at the Pan Pacific was well worth the money! We stayed three nights and found the hotel was first class in service from all staff. Special mention to Abdi who helped us check in early after a long flight. He also upgraded our room which only helped our exoerience. The hotel is in a great location with easy access to transport.,5 out of 5,October 2022,5.0 of 5 stars,#33 of 372 hotels in Singapore,0.28318452380952386,0.5360119047619047,64.15922619047619,53.601190476190474,28.318452380952387,Services
Pan Pacific Singapore,Great location in Singapore,This is a great hotel in an excellent central location. There is some building work going on the we were aware of but there was no bar/lounge facilities due to this redevelopment otherwise the score would have been higher. The room was good value and the breakfast was as good as you will get anywhere globally.,4 out of 5,October 2022,5.0 of 5 stars,#33 of 372 hotels in Singapore,0.39722222222222225,0.48055555555555557,69.86111111111111,48.05555555555556,39.72222222222223,Location
Pan Pacific Singapore,None,"Beautiful hotel, friendly and efficient staff who went out of their way to help. Upgraded room due to renovations taking place. Not disturbed by noise from our allocated room. Clean and comfortable and a great place to relax after a long haul flight.",4 out of 5,October 2022,5.0 of 5 stars,#33 of 372 hotels in Singapore,0.37380952380952387,0.6464285714285715,68.69047619047619,64.64285714285715,37.38095238095239,General
Pan Pacific Singapore,Good food and service from Tommy,Good food and service at the Teppanyaki counter from Tommy Yeo. Food was nicely cooked as per our request and served at the right timing. Enjoyed our meal at the restaurant and will definitely visit again.,5 out of 5,October 2022,5.0 of 5 stars,#33 of 372 hotels in Singapore,0.4171428571428571,0.667142857142857,70.85714285714285,66.71428571428571,41.71428571428571,Amenities
Pan Pacific Singapore,Birthday celebration,Very good food & ambience. Exceptional & excellent service by staff Paulyn. Location at Pan Pacific hotel level 3. Central in singapore. Good for big family. Many nice places for photo taking. Amex & uob cards discounts available.,5 out of 5,October 2022,5.0 of 5 stars,#33 of 372 hotels in Singapore,0.5307407407407407,0.6255555555555556,76.53703703703704,62.555555555555564,53.074074074074076,Amenities
Pan Pacific Singapore,Amazing Service by Janice,"It has been 2 years since I last visited Lan Pacific Hotel. During my 6 day stay, I was so looking forward to my stay here and it seems like the pandemic didn’t affect Pan Pac (though we know your struggles) but what I was looking forward more to was to see familiar faces and Janice who greeted us at Edge every start of our day MAKES a difference to my colleagues and I. Thank you for managing to retain Janice in your manpower pool and kudos to all departments for an efficient service and keeping my room clean! we hope to see you again next year!",5 out of 5,October 2022,5.0 of 5 stars,#33 of 372 hotels in Singapore,0.2666666666666667,0.35333333333333333,63.33333333333333,35.333333333333336,26.66666666666667,Services
Pan Pacific Singapore,Fantastic stay at Pan Pacific Singapore,"First time back at Pan Pacific Singapore since Covid !!! Fabulous view of Marina bay from the room and the club lounge is amazing. Shine by name and shine nature, thank you for looking after us so well.",5 out of 5,October 2022,5.0 of 5 stars,#33 of 372 hotels in Singapore,0.3125,0.5583333333333333,65.625,55.833333333333336,31.25,Location
Pan Pacific Singapore,Breakfast at the Pan Pacific,"There is no finer way to start the day than being greeted by the lovely Janice and then being escorted to your table of choice at the Rang Mahal. Wonderful food, fantastic service. Again, I’m more than ready for the day ahead.",5 out of 5,October 2022,5.0 of 5 stars,#33 of 372 hotels in Singapore,0.52,0.73,76.0,73.0,52.0,Services
Pan Pacific Singapore,Yummy teppan,"Nice ambience at the teppan counter for an anniversary lunch. Served by Chef Tommy. It was a pleasant experience. Thank you! Would recommend this place for fresh lobster, prawns, and salmons!! Love the gardens outside too!",4 out of 5,October 2022,5.0 of 5 stars,#33 of 372 hotels in Singapore,0.4970833333333333,0.6233333333333333,74.85416666666667,62.33333333333333,49.70833333333333,Amenities
Pan Pacific Singapore,Best teppanyaki in Singapore,"Tommy was such an entertaining chef with great skills! The food was fantastic, everything tasted so good. Would definitely recommend sitting at the counter, but counter seats will require an order of a set per pax. Definitely coming back!",5 out of 5,October 2022,5.0 of 5 stars,#33 of 372 hotels in Singapore,0.32499999999999996,0.55625,66.25,55.625,32.49999999999999,Amenities
Pan Pacific Singapore,Keyaki,one of the best teppanyaki in sg. chef tommy prepared his specialty yuzu sauce for my set course and he made it taste so extraordinary. it was such a pleasant experience and i would definitely visit again.,5 out of 5,October 2022,5.0 of 5 stars,#33 of 372 hotels in Singapore,0.4133333333333333,0.6533333333333333,70.66666666666667,65.33333333333333,41.33333333333333,Amenities
Pan Pacific Singapore,Teppanyaki at Keyaki.,Great dining experience at Keyaki. Especially nice to be seated at the Teppan table. Served by chef Tommy Yeo who was very friendly and provided great food as well as tips on enjoying the dishes he cooked and served to us,5 out of 5,October 2022,5.0 of 5 stars,#33 of 372 hotels in Singapore,0.7175,0.75,85.875,75.0,71.75,Amenities
Pan Pacific Singapore,Great Service with Quality Food,Chef Tommy Yeo from Keyaki Teppanyaki Counter provided excellent service and prepared delicious food. He is able to cater to our preference and also intro his own special sauce to go with beef. Enjoyed the experience!,5 out of 5,October 2022,5.0 of 5 stars,#33 of 372 hotels in Singapore,0.6803571428571429,0.8160714285714286,84.01785714285714,81.60714285714286,68.03571428571429,Amenities
Pan Pacific Singapore,Keyaki,We dine at Keyaki excellent tepanyaki lunch set. We ate the Hana and Kaze set. Served by chef Tommy. Tommy gave good recommendations on lunch menu. Service staff was attentive to our needs for drinks and condiments. Food service was prompt thank you. Will come back again,5 out of 5,October 2022,5.0 of 5 stars,#33 of 372 hotels in Singapore,0.525,0.625,76.25,62.5,52.5,Services
Pan Pacific Singapore,None,there was too much noise and we couldn't sleep well at night. the hotel needs to close for a while during the maintenance period. there were many maintenance areas in the hotel for restructuring but they were not planned well.,1 out of 5,October 2022,5.0 of 5 stars,#33 of 372 hotels in Singapore,0.35,0.35,67.5,35.0,35.0,General
Pan Pacific Singapore,The Keyaki Experience,"Keyaki - Love the teppanyaki set! Great value and great taste! We went for the Ten (Wagyu) and Kaze (Lobster) sets, fresh and succulent, no additional dips / sauce required! Look for Chef Tommy for his special take of the lobster on grill with his special sauce!",5 out of 5,October 2022,5.0 of 5 stars,#33 of 372 hotels in Singapore,0.514795918367347,0.5346938775510204,75.73979591836735,53.46938775510204,51.4795918367347,Amenities
Pan Pacific Singapore,Lovely stay,Had a fabulous stay for 5 nights over the F1 weekend got the harbour club studio (3513)room and was lovely quiet and comfortable the room might be slightly dated but was still lovely and the view magnificent Breakfast great service and selection and with champagne it was served in the Edge restaurant a designated area for Pacific club guests a little disappointed as not on the 38 floor in the club lounge Afternoon and evening drinks in the club lounge made the stay sensational great service good food choices and drinks galore and what a view Siti was a gem so helpful and so good at her job Emma was so friendly and the other staff were all fabulous thank you for making our stay fabulous,5 out of 5,October 2022,5.0 of 5 stars,#33 of 372 hotels in Singapore,0.35625000000000007,0.6828703703703705,67.81250000000001,68.28703703703705,35.62500000000001,General
Pan Pacific Singapore,5 star experience,We went to Keyaki Restaurant for dinner. The chef that attended to us was Tommy Yeo. The food was delicious and served in a timely manner. Chef Tommy Yeo paid special attention to how we wanted each course and even cleared our plates and served the next course without us having to wait.,5 out of 5,October 2022,5.0 of 5 stars,#33 of 372 hotels in Singapore,0.4523809523809524,0.5238095238095238,72.61904761904762,52.38095238095239,45.23809523809524,Services
Pan Pacific Singapore,Enjoyable Day at Keyaki!!,Today come over Keyaki to celebrate our first year anniversary .. Keyaki full of good vibes and Japan environment as well (especially the garden).. The most heart warming thing is one of their staff_Jeff who served us a piece of cake and with Happy Anniversary on it !! This is out of our expectations !! So enjoy and Thx to the team !,5 out of 5,October 2022,5.0 of 5 stars,#33 of 372 hotels in Singapore,0.4714285714285714,0.6404761904761905,73.57142857142858,64.04761904761905,47.14285714285714,Services
Pan Pacific Singapore,"A lovely evening at Keyaki, Pan Pacific Singapore","We went to Keyaki for Teppanyaki last evening. Chef Tommy Yeo was friendly & hospitable, and he struck a nice balance of flavours for the dishes we ordered. The dishes were yummy and the meats were done exactly to our preferences. Both Chef Tommy and Manager Joseph were attentive yet unobtrusive in their service which was great! Coupled with the lovely ambience of the restaurant, it was a pleasurable evening.",5 out of 5,October 2022,5.0 of 5 stars,#33 of 372 hotels in Singapore,0.44642857142857145,0.6023809523809524,72.32142857142857,60.238095238095234,44.642857142857146,Services
Pan Pacific Singapore,Tepannyaki lunch,"Chef Tommy Yeo was good, he recommended interesting items from the menu. Every dish he cooked was done to perfection, he was very warm and friendly to my family. Job well done. Will be coming back again.",5 out of 5,October 2022,5.0 of 5 stars,#33 of 372 hotels in Singapore,0.471,0.476,73.55000000000001,47.599999999999994,47.099999999999994,Amenities
Pan Pacific Singapore,Keyaki pan pacific,"Managed to get seats at the Teppanyaki counter and was served by Chef Tommy Yeo . He is pleasant, friendly and makes us feel so welcomed . Ambience is nice, food is good and of quality. Will come back again.",4 out of 5,October 2022,5.0 of 5 stars,#33 of 372 hotels in Singapore,0.48166666666666663,0.6133333333333334,74.08333333333333,61.33333333333334,48.166666666666664,Services
Pan Pacific Singapore,Great meal,Tommy was really nice!! it was my mom’s birthday and he made sure to treat us (and my mom) extra special :-) he recommended us the wagyu set which was really good.. and we enjoyed ourselves thoroughly.. thank you for the memorable evening!,5 out of 5,October 2022,5.0 of 5 stars,#33 of 372 hotels in Singapore,0.5149553571428571,0.7325396825396825,75.74776785714286,73.25396825396825,51.49553571428571,Services
Pan Pacific Singapore,My Hotel of Choice in Singapore,"My 6th stay at the Pan Pacific Singapore in the last 8 years is a testament to the excellence of this hotel. All staff I encountered were friendly and welcoming, which adds a lovely personal touch to the hotel. The Pacific Club lounge is lovely space to relax in the evening with canapes and drinks, although it was not open for breakfast, which was a disappointment. Hotel facilities are excellent, the rooms are spacious and comfortable and the in-house restaurants superb.",5 out of 5,October 2022,5.0 of 5 stars,#33 of 372 hotels in Singapore,0.3175,0.6066666666666667,65.875,60.66666666666667,31.75,General
Pan Pacific Singapore,Coctail Night,Accommodating staff and friendly. Good drinks! Drinks are on point specially the Singapore Sling! Bartender is the best! Will definitely go back. Foods are great. Just right for light meal and good drinks and night chill. Will definitely comeback and experience the great stuff I experienced the first time.,5 out of 5,October 2022,5.0 of 5 stars,#33 of 372 hotels in Singapore,0.5178571428571428,0.5415750915750915,75.89285714285714,54.15750915750915,51.78571428571428,Amenities
Pan Pacific Singapore,Great Teppanyaki,Thanks Chef Tommy! A rare experience in Singapore. Too tasty to snap any picture except for the sashimi. an absolutely delicious meal. we will be sure to return in the future. Wish we took more photos!,5 out of 5,October 2022,5.0 of 5 stars,#33 of 372 hotels in Singapore,0.4458333333333333,0.6023148148148149,72.29166666666667,60.23148148148149,44.58333333333333,Amenities
Pan Pacific Singapore,"""...characterised by the warm smiles, unassuming postures and thoughtful processes...""","In all our years of staying at countless properties around the world, this is by far THE benchmark of nightmares. and to make matters worse, it was my 2 year old's first staycation. Years of flawless memorable check ins around the world, ruined forever on this day. Nevermind that no anniversary amenities were provided despite prior email correspondence & acknowledgement (we're all human), nevermind that the hotel was having drilling as part of renovation works (upgrading is always understandable & exciting), nevermind that the E-concierge/in room dining feature wasn't able to process a simple order of french fries for an extremely hungry/tired/distraught baby and wife (save the earth, no menus - we support no problem. but maybe fix the patchy wifi first?), nevermind that no",2 out of 5,October 2022,5.0 of 5 stars,#33 of 372 hotels in Singapore,0.165,0.5232539682539682,58.25,52.32539682539682,16.5,Services
