hotelname,title,desc,reviewRatings,reviewDate,hotelClass,hotelRank,polarity,subjectivity,Normalized_Polarity,Normalized_Subjectivity,Normalized_Polarity_POS_NEG,Category
Pan Pacific Singapore,Long wait lines,"Though the stay was comfortable and the hotel clean and lovely, there should be better and more efficient service. There should be more counters open during check out at 12. There was a long queue of people waiting to check out. For a 5 star hotel, this can be improved.",4 out of 5,August 2021,5.0 of 5 stars,#33 of 372 hotels in Singapore,0.33958333333333335,0.58125,66.97916666666667,58.12500000000001,33.958333333333336,General
Pan Pacific Singapore,Amazing hotel at the heart of the City,"If you're looking for a place that is amazing and near all the attraction, Pan Pacific is a good place to stay while in Singapore. good amenities, waling distance to the tourist attraction, accessible for transportation and malls connecting for your shopping needs. I love our room it has a nice and spacious area overlooking the Singapore Flyer. nice and comfy bed and of course the bathroom that comes with a tub for relax and quality ""me time "" experience. it comes with a nice smelling toiletries it comes with buffet Breakfast with we all love and various variety of menu to choice from. after brekky, we headed down to the pool and relax by the pool sun bed. enjoying. that sums up our luxurious experience at a minimal cost. Pan pacific doesnt disappoint :) xoxo next time",5 out of 5,February 2022,5.0 of 5 stars,#33 of 372 hotels in Singapore,0.37621527777777775,0.6289930555555555,68.81076388888889,62.89930555555555,37.62152777777777,Amenities
Pan Pacific Singapore,Highly recommended,"Great place to unwind, beautiful hotel. If you’re looking for a hotel in SG, this would be the option for you. Impeccable service and the staff are super friendly. Do give it a shot, you won’t regret.",5 out of 5,April 2022,5.0 of 5 stars,#33 of 372 hotels in Singapore,0.6216666666666667,0.7333333333333333,81.08333333333333,73.33333333333333,62.16666666666667,General
Pan Pacific Singapore,"Glamorous and civilized, order and clean, nice people and a awesome food!!","It was a great experience for me and my wife, we visited on our way, city of Singapore, with his amaising building specialy in Harbour area, the famous hotel Peninsula and botanic gardens!!.It was the celebration of Singapore State town, everything was in celebration coat, and a lot of people were celebrating!!. We visited Victorian buildings, the famous China Market and Small India, the building of Fire extinguisher building, metro rail ways and many Malls!!",4 out of 5,May 2022,5.0 of 5 stars,#33 of 372 hotels in Singapore,0.5225,0.73,76.125,73.0,52.25,Location
Pan Pacific Singapore,Friendly & Great Experience with Excellent Service,We were greeted and serviced daily at the Edge Buffet Breakfast by Janice who was a highlight of our trip with her great enthusiasm and friendly nature. She was very comforting and gave us many tips for our holiday while here in Singapore.,5 out of 5,July 2022,5.0 of 5 stars,#33 of 372 hotels in Singapore,0.375,0.41,68.75,41.0,37.5,Services
Pan Pacific Singapore,Delicious food,"My friend bought me to pan pacific to had dinner, the food was great and was serve on time. Despite that it was a busy period during dinner, the manager John Ong came and ask if we need anything, and was caring.",5 out of 5,July 2022,5.0 of 5 stars,#33 of 372 hotels in Singapore,0.45,0.525,72.5,52.5,45.0,Services
Pan Pacific Singapore,Honeymoon 1st leg,"This hotel is fabulous. Staff are amazing, (special shout out for TJ on the concierge desk, his enthusiasm for his work is off the scale). Perfectly situated for Marina Bay Sands, Gardens by the Bay, Raffles Hotel, Clarke Quay, Boat Quay, Botanic Gardens, Singapore Flyer, Little India, China Town and just about anything else you could possibly want to see or do in the City. The hotel pool is gorgeous and so relaxing. Hotel is spotlessly clean, rooms are beautiful and comfortable. I really can't big this place up enough.",5 out of 5,July 2022,5.0 of 5 stars,#33 of 372 hotels in Singapore,0.373859126984127,0.7476190476190476,68.69295634920634,74.76190476190476,37.385912698412696,Location
Pan Pacific Singapore,None,"Thank you Team, I enjoyed my stay and slept well. I greatly appreciate the request for additional pillows. I love the size of the King Bed, that's one of the reason I am back to stay with you :) A good sleep always make my day ends with a SMILE. Breakfast was good but slightly noisy thou. Have a great day ahead :)",5 out of 5,July 2022,5.0 of 5 stars,#33 of 372 hotels in Singapore,0.46666666666666673,0.5696969696969697,73.33333333333334,56.96969696969697,46.66666666666667,General
Pan Pacific Singapore,Great food and impeccable service,"Awesome food and great service from all restaurant staff, especially Jeff, who was exceptionally friendly and helpful! He made great recommendations and had a smile on his face while attending to us (: We had a great time overall and would highly recommend Keyaki to everyone!",5 out of 5,July 2022,5.0 of 5 stars,#33 of 372 hotels in Singapore,0.4854166666666666,0.5988888888888888,74.27083333333333,59.88888888888888,48.54166666666666,Services
Pan Pacific Singapore,Great hotel service let down by poorly trained sales and reservation dept,My stay at Pan Pacific was fantasic and the service was excellence. However i cannot say the same for the room reservation experience. Poorly trained sales and reservation team that bungled up price matching.,2 out of 5,July 2022,5.0 of 5 stars,#33 of 372 hotels in Singapore,-0.2,0.3625,40.0,36.25,20.0,Value
Pan Pacific Singapore,Pleasant stay,"Lovely staff (Abhi), we asked for 2 rooms close to each other and he is willing to help us and successfully find the rooms, Great location close to MRT but we mostly use taxi which is always available in front of the hotel, close to shopping mall and restaurants, We really had a great time here. Highly recommended",5 out of 5,July 2022,5.0 of 5 stars,#33 of 372 hotels in Singapore,0.42350000000000004,0.5965,71.175,59.650000000000006,42.35,Services
Pan Pacific Singapore,Highly recommended… check the review for details,"Overall the hotel was very good, location was prime, staff extremely helpful and friendly, rooms were comfortable… If anything needs an update it would be the carpets in the room as carpets in general are not the most hygienic things in hotel rooms.. I also like the fact that the hotel showers had big bottles of shampoo, shower gel and conditioner installed, as this reduces the amount of plastic waste from the small disposable bottles.. this is the best thing for an environmentally conscious hotel.. The hotel buffet had a wide variety of different cuisines and the room service was good as well.. Bed was comfortable, room balcony had a nice view… Hotel was connected to two malls and you can cross to the Bay Area from the sky bridge..",5 out of 5,July 2022,5.0 of 5 stars,#33 of 372 hotels in Singapore,0.23294117647058823,0.4694117647058823,61.64705882352941,46.94117647058823,23.294117647058822,Cleaniness
Pan Pacific Singapore,Mixed feelings- last stay in 2019 was so much better,"Helpful and friendly staff, good concierge service. Actually only one minus point- breakfast is rather poor. Very limited selection at buffet, no variations at all during our 4 days stay, quality of food average at best, taste of food below average",4 out of 5,July 2022,5.0 of 5 stars,#33 of 372 hotels in Singapore,0.13134920634920635,0.4539682539682539,56.567460317460316,45.39682539682539,13.134920634920636,Services
Pan Pacific Singapore,Very Disappointed,"Hubby & I have been to the Pan Pacific Marina Bay for 8 times now. We have always had a perfect holiday so get really excited to go back. Especially so this time as we waited for 4 years due to personal reasons & Covid. Unfortunately our experience this time was terrible & we left very upset & honestly are thinking of not going back again, which is unheard of for us. The stay didn't start well.... We arrived from the UK at 6 am which we have done many times before. The receptionist was unhelpful & basically gave us a ""don't give a toss"" attitude! We were told we couldn't check in for at least 8 HOURS!!! We asked if there was a room we could freshen up & change so we didn't have to sit in reception for this amount of time. We were told no as the hotel had an event the previous",3 out of 5,July 2022,5.0 of 5 stars,#33 of 372 hotels in Singapore,0.02815972222222223,0.5127777777777778,51.407986111111114,51.27777777777778,2.8159722222222228,Services
Pan Pacific Singapore,"Professional staff, View of Marina Floating Platform, Breakfast could be better","We had various unique questions and requests, and the reservations team was prompt and professional in handling them. Thankful that they arranged for us the two conjoint rooms with the best view of the National Day Parade happening on the Marina Floating Platform, and we could witness all the live action of the parade from the comfort of our room. Checking in and out took less than five minutes each, even though they only had two staff at the Front Desk at any one time. Front desk manager Alicia was quick to come out of her office to offer assistance whenever she noticed that guests were in the queue for a few minutes. Amazing proactiveness. Location-wise, it is amazingly well connected to Marina Square, Suntec City and Millenia Walk as they are all less than 3 minutes' walk",4 out of 5,July 2022,5.0 of 5 stars,#33 of 372 hotels in Singapore,0.14742424242424243,0.43333333333333335,57.371212121212125,43.333333333333336,14.742424242424242,Services
Pan Pacific Singapore,Wonderful Allan (Alan) !,"As a regular patrons of this hotel, I was attracted to try the floating pods over a reflection pool at the lobby Pan Pacific hotel hence I decided to drop by to experience it. Being told one of the luxury hotel in Singapore, the service we experienced received in this outlet was downfall to compared to other luxury hotel. Staff who attended to us, a man & a lady (wearing a black suit) didn’t met our expectations as the basic body language, the tone of voice as well as the communication, how they carry themselves is very unprofessional. It gives a negative connotation to Pan Pacific. The food was average and we are unable to request for how the doneness for the beef burger (it’s all well done only). Our request was outright rejected without any options given. On settling",3 out of 5,July 2022,5.0 of 5 stars,#33 of 372 hotels in Singapore,-0.02416666666666665,0.451025641025641,48.791666666666664,45.1025641025641,2.4166666666666647,Services
Pan Pacific Singapore,Great Hotel let down by disappointing Club experience,"We have been staying at the PanPacific for many years. It has always been our hotel of choice. We returned after the couple of years od covid lockdown expecting the hotel to be the same as the pre-covid days. We stayed for 13 nigts from 27 JUne 2022 to 10 July 2022. The hotel itself is the same and the Club suites are just as they used to be. The staff at the Club lounge (eg Shine, Macluther are still there are doing a wonderful job as they always have. A lovely group of professional and attendtive staff - who have become friends over the years). We stayed for 2 weeks. Lovely suites. Great check in experience and great communication from Shine, who was always extremely helpful and professional. But the overall experience was very disappointing. The new management of the Hotel",4 out of 5,July 2022,5.0 of 5 stars,#33 of 372 hotels in Singapore,0.2522402597402597,0.5224675324675324,62.61201298701299,52.246753246753244,25.22402597402597,General
Pan Pacific Singapore,Great visit. Great Service,"Stayed at Pan Pacific for almost 20 days and the entire stay was fantastic. What stood out for me were the servicing standards at the hotel be it at the pool, reception, room and at the buffet restaurant Edge. Special shoutout to Janice at the Edge for making the breakfast routine comfortable and delightful with her promptness and care.",5 out of 5,July 2022,5.0 of 5 stars,#33 of 372 hotels in Singapore,0.4314285714285714,0.7792857142857142,71.57142857142857,77.92857142857143,43.14285714285714,Services
Pan Pacific Singapore,Great hotel in great location,"Beautiful hotel, lovely rooms . Great service. Very close to Gardens on the bay and Marina bay attractions. Club room experience is fabulous with panoramic views of the bay and excellent selection of snacks in the evening.",5 out of 5,July 2022,5.0 of 5 stars,#33 of 372 hotels in Singapore,0.6250000000000001,0.7999999999999999,81.25,80.0,62.500000000000014,Amenities
Pan Pacific Singapore,Avoid in-room dining.,"The burger ordered was cooked to just before it became a briquet. Extremely dry and tasteless. Wagyu beef burger? I've had juicier burgers at the local McD. Eat at at the cafe, so it's easier to feedback.",3 out of 5,July 2022,5.0 of 5 stars,#33 of 372 hotels in Singapore,-0.2222222222222222,0.5,38.88888888888889,50.0,22.22222222222222,Amenities
Pan Pacific Singapore,Exceeded Expectation Services from PanPac,"The hotel services is top notch. My special request made was met and exceeded my expectation. Thank you for making my wedding anniversary a special and fruitful one. Thank You Abhi for your outstanding counter services. Rest of the hotel facility i wont go into details, they are very good and proper upkeep. Good work Pan Pacific Team. Will revisit my stay again soon with Pan Pacific",5 out of 5,July 2022,5.0 of 5 stars,#33 of 372 hotels in Singapore,0.47489795918367356,0.5711224489795919,73.74489795918367,57.11224489795919,47.489795918367356,Services
Pan Pacific Singapore,Birthday - Great Service by Jeff,We had the Keyaki Kaiseki 8 course meal. Jeff (our server) was very passionate about the food and offered interesting insights about the flavours and how it was meant to be enjoyed. Also recommended a fantastic sake for ladies. Great service and food for a birthday celebration!,5 out of 5,July 2022,5.0 of 5 stars,#33 of 372 hotels in Singapore,0.46699999999999997,0.77,73.35000000000001,77.0,46.699999999999996,Amenities
Pan Pacific Singapore,Disappointing.,"Not well trained staff, extremely long check out, rooms are old and not in adequate condition, price too high for what you get. I will not come back. Positive was the view on Marina bay and the location.",1 out of 5,July 2022,5.0 of 5 stars,#33 of 372 hotels in Singapore,0.12843434343434343,0.3364646464646464,56.42171717171717,33.64646464646464,12.843434343434343,Services
Pan Pacific Singapore,Will never return - very disappointed in Singapore,"Property was decent, service and processes are horrible. Room itself was musty and old, but decently-maintained. 1. Pre-charged me 150% of the room fee on booking. When asked why, staff had no idea why and refunded me the extra 50%. While emailing reservations support, the staff tried to upsell me a package instead of trying to resolve my problems. 2. Did not give me the free carpark coupon which was my entitlement. The carpark fee would have been $50 otherwise. Had to queue all over again to get it (oh, and check in is very long!) 3. Made me pay for a kids meal when as part of the family package, kids should have dined free. This was despite me asking staff to double-check whether my package had any offers. 4. Served my kids 2 days expired macarons as part of the",2 out of 5,July 2022,5.0 of 5 stars,#33 of 372 hotels in Singapore,0.010677083333333334,0.5108333333333334,50.53385416666667,51.083333333333336,1.0677083333333333,Value
Pan Pacific Singapore,Keyaki Restaurant,"Paid this restaurant a visit for my mother’s birthday. Ambience is beautiful; there is a koi pond and waterfall outside, and the architecture whisks you to Japan. The food is wonderful, particularly the teppanyaki dishes they are famous for. Our server, Jeff, was adorable and gave great recommendations for food. Jeff was always on top of everything, and I was really impressed by his top-notch service. Can’t wait to come again :)",5 out of 5,July 2022,5.0 of 5 stars,#33 of 372 hotels in Singapore,0.6196969696969696,0.7848484848484848,80.98484848484848,78.48484848484848,61.96969696969696,Amenities
Pan Pacific Singapore,bad service,"I travel a lot and stay in 5-star hotels, but the stay in your hotel was the worst, as there are not enough staff for the reception, as it took me more than an hour to check in & i have 2 rooms i got one and the other was not ready till 2 hours later please note my checkin time was 3:30pm",1 out of 5,July 2022,5.0 of 5 stars,#33 of 372 hotels in Singapore,-0.12083333333333333,0.4791666666666667,43.958333333333336,47.91666666666667,12.083333333333334,Services
Pan Pacific Singapore,Birthday Celebration at Keyaki,Very dedicated crew that makes you feel welcomed throughout. Jeff was particularly dedicated and prepared a small surprise for the birthday boy (my husband). Food was preparation was masterful. Ingredients were of quality. A very pleasant Japanese cuisine on the overall.,5 out of 5,July 2022,5.0 of 5 stars,#33 of 372 hotels in Singapore,0.2957142857142857,0.4333333333333333,64.78571428571429,43.33333333333333,29.57142857142857,Services
Pan Pacific Singapore,Seriously high end. Loved it,"We stayed in the Skyline Suite. The views from the room were breathtaking by day and even more stunning by night. The glass walled lift on the way up giving views of the city was also a nice touch. The room was clean, spacious and serviced daily. The gym was upmarket and well-equipped and the lobby and bar had a trendy, high-end feel to them. We absolutely loved the Pacific Club Lounge, particularly the afternoon tea and cocktail hour. The staff throughout the hotel were friendly and helpful. Dian in the Pacific Club Lounge particularly stood out. As well ask keeping us well oiled with the complimentary champagne, she was also very friendly and gave us lots of tips on places to visit and food and drink to try. Breakfast was served in a pleasant restaurant and there was a",5 out of 5,July 2022,5.0 of 5 stars,#33 of 372 hotels in Singapore,0.46398809523809526,0.655952380952381,73.19940476190476,65.5952380952381,46.398809523809526,Amenities
Pan Pacific Singapore,High tea at atrium,Enjoyed the high tea set and the service was superb. Jia Yi and Alan were attentive to our needs and very helpful! We had a hen’s party for my sister and they helped to coordinate the photo taking and even gave us an extra cake for the occasion.,5 out of 5,July 2022,5.0 of 5 stars,#33 of 372 hotels in Singapore,0.385,0.59,69.25,59.0,38.5,Services
Pan Pacific Singapore,Anniversary Celebration,"The food is really delicious and how the service are all very efficient and fast. Especially Jeff who served us. He was really friendly and even let us know that our food has arrived. He even offered to take photo for us. At the same time, he also have good recommendation for the food. I love the tuna belly and wagyu beef the most as it was thick cut and juicy for the beef.",5 out of 5,July 2022,5.0 of 5 stars,#33 of 372 hotels in Singapore,0.3175,0.57,65.875,56.99999999999999,31.75,Amenities
Pan Pacific Singapore,Helpful and Friendly Service Crew,"The service crew (Jiayi & Alan) was very helpful and friendly - went to the extra mile to make our high tea experience a seamless and enjoyable one. Above all, the comfortable seating and relaxing ambience contributed to our pleasant time. Thank you so much!",5 out of 5,July 2022,5.0 of 5 stars,#33 of 372 hotels in Singapore,0.2718333333333333,0.4206666666666667,63.59166666666667,42.06666666666667,27.18333333333333,Services
Pan Pacific Singapore,"Beautiful hitel, highly recommend.","Beautiful and centrally located hotel. We had a very comfortable room with balcony and magnificent views of both Marina Bay Sands and the merlion. Staff is very friendly and helpful. We were here on a 2 day layover and it was very nice to relax at the pool and recover from jetlag. Lots of sunbeds in the shadow, great views from the pool. Hotel is connected to a shopping mall and we walked to the Marina Bay area in 10 minutes ( partially via the the shopping mall in the airco).",5 out of 5,July 2022,5.0 of 5 stars,#33 of 372 hotels in Singapore,0.5421875,0.74375,77.109375,74.375,54.21875000000001,Location
Pan Pacific Singapore,Great experience at the place and food was good.,"Bought my friend over for dinner, it was their first time and they had a great impression. Even though it was busy, the staff are still friendly and helpful. The food was great too. Frankie, Michelle and Tian Tian were helpful. I Will definitely visit again.",5 out of 5,July 2022,5.0 of 5 stars,#33 of 372 hotels in Singapore,0.3875,0.5222222222222223,69.375,52.22222222222223,38.75,Services
Pan Pacific Singapore,What an unforgettable Lunch,"Jeffery, the waiter who served us, really went above and beyond to ensure that all our needs were met. When he knew that one of the member in the family is celebrating her birthday, he arranged for a complementary birthday cake. What an enjoyable experience. On top of that the food was fantastic as well.",5 out of 5,July 2022,5.0 of 5 stars,#33 of 372 hotels in Singapore,0.32,0.45999999999999996,66.0,46.0,32.0,Services
Pan Pacific Singapore,Nice vacation,"This is the 2nd time we stay at this hotel. After 5 years, we still have good experience. The breakfast buffet is still good. The rooms and common areas are well maintained. The location of the hotel is a plus.",4 out of 5,July 2022,5.0 of 5 stars,#33 of 372 hotels in Singapore,0.27499999999999997,0.42500000000000004,63.74999999999999,42.50000000000001,27.499999999999996,General
Pan Pacific Singapore,Amazing food,Jeff provides amazing services! Came here for a friend’s birthday and was pleasantly surprised by Jeff’s attentiveness :) He even brought a cake for us and check in on us every now and then without interruption! Food was okay tho but the exterior is pretty,5 out of 5,July 2022,5.0 of 5 stars,#33 of 372 hotels in Singapore,0.445,0.86,72.25,86.0,44.5,Services
Pan Pacific Singapore,Testimonial for Jeff,Dinner was good and service was excellent. We were serve by Jeff who was really attentive and service oriented. He realised that it’s my friend’s birthday and he offered to give us a cake. He takes pride in his work and could feel his passion in his job. Really had a great dining experience Here! Great work mr Jeff! We had a great time a keyaki and would definitely recommend my friends here.,5 out of 5,July 2022,5.0 of 5 stars,#33 of 372 hotels in Singapore,0.6375000000000001,0.68125,81.87500000000001,68.125,63.75000000000001,Services
Pan Pacific Singapore,"Nice hotel, good location…,.","Nice hotel in a good location with good food options and great gym and pool facilities. Service was excellent, only downside is that you will pay extra for everything (early/late check in, check out), extra bed, room upgrade at hotels suggestion, which is slightly disappointing given not the cheapest option to start…..",4 out of 5,July 2022,5.0 of 5 stars,#33 of 372 hotels in Singapore,0.3555555555555555,0.6499999999999999,67.77777777777779,64.99999999999999,35.55555555555555,Value
Pan Pacific Singapore,Front office staff is not friendly and not helpful,"During checkin, i do not feel been treated as a guest in the hotel. Front office staff just showing her not so happy face and implying that is not my problem. She try not to listen to the customer explanation",1 out of 5,July 2022,5.0 of 5 stars,#33 of 372 hotels in Singapore,0.8,1.0,90.0,100.0,80.0,Services
Pan Pacific Singapore,Keyaki - birthday lunch,I was here with my friends for my birthday celebration in July. Came with a cake. Nice ambience and experience. First weekend here for the brunch. The food was served promptly by Alicia and Jeff. The recommended drink goes well with the food.,4 out of 5,July 2022,5.0 of 5 stars,#33 of 372 hotels in Singapore,0.425,0.6666666666666666,71.25,66.66666666666666,42.5,Amenities
Pan Pacific Singapore,1 Star Service,"We have went to many 5 star hotels in Singapore for staycation but Pan Pacific Hotel is the worse in terms of value and service. We had to queue super long during check in when there weren't many people in the first place. The counter only had two pax and waved us away when we told them we had already checked in earlier and were just waiting for keys. So we wanted to go to this Urban Jungle Village place which was a kids playground and they had this socks policy which was fine. But we didn't have any and asked if we could purchase one but no they didn't have any for sale and just pointed us out without any form of solution. We eventually headed to Marina Square to play at Pororo Park which had socks for sale. Compared with the kids playground at Shangri-la Hotel, the one at",1 out of 5,July 2022,5.0 of 5 stars,#33 of 372 hotels in Singapore,0.155,0.5,57.75,50.0,15.5,Value
Pan Pacific Singapore,A cosy and intimate wedding,"We held an intimate solemnization ceremony & dinner celebration at Hai Tien Lo. The service team was good and food was delicious and aesthetically pleasing. Chose this hotel also due to the spacious lobby, walkways and drive-in area making both ourselves and our guests comfortable.",5 out of 5,July 2022,5.0 of 5 stars,#33 of 372 hotels in Singapore,0.43499999999999994,0.675,71.75,67.5,43.49999999999999,Services
