hotelname,title,desc,reviewRatings,reviewDate,hotelClass,hotelRank,polarity,subjectivity,Normalized_Polarity,Normalized_Subjectivity,Normalized_Polarity_POS_NEG,Category
The Scarlet Singapore,Really Sincere and very Warm Service from Faiz,"I walked in to the hotel to see the actual room that I exactly want; and Faiz took his time to show me few rooms with so much patience and without hesitance! This is very rare in the hotel industry nowadays as mostly the staff are either not warm or not as genuine. We only intend to stay few hours and so we didn’t want the grand room; yet he treated me as special guest. He didn’t know this, but I’m actually a regular of their hotel. And this is why I keep coming back to this place because of their genuine hospitality. To Faiz, you’re a rare gem and keep up the good work! 🙂",5 out of 5,February 2022,4.0 of 5 stars,#17 of 372 hotels in Singapore,0.20718487394957985,0.47049127343244984,60.359243697478995,47.04912734324498,20.718487394957986,Services
The Scarlet Singapore,5-Star Excellence From Nazir,"I've stayed in Scarlet hotel for about a dozen times and I've always been impressed by Mr Nazir's friendliness, eagerness to help, and also his excellent attitude. He's very polite, professional and at the same time, very welcoming. He's a good example of how a frontline hotel ambassador ought to be. For example, during a stay in February, he takes his own initiative to make my girlfriend and I feel welcomed. I told him that tomorrow is my girlfriend's birthday and I left for a walk, not expecting him to do anything as we were just chatting. However, when I returned with my girlfriend, we were surprised by the birthday card and chocolates he placed by our door. It was really a pleasant surprise! I think I really owe him a good review here, he deserves it. I hope the hotel",5 out of 5,February 2022,4.0 of 5 stars,#17 of 372 hotels in Singapore,0.43974358974358985,0.5455128205128206,71.9871794871795,54.55128205128206,43.974358974358985,Services
The Scarlet Singapore,My stay at the scarlett,We are very pleased that the staff were able to accommodate us for our early check in and late checkout request. We had a pleasant stay and will def keep this place in mind for the future. The mini bar was for free too!,4 out of 5,February 2022,4.0 of 5 stars,#17 of 372 hotels in Singapore,0.31190476190476185,0.630952380952381,65.5952380952381,63.0952380952381,31.190476190476186,Services
The Scarlet Singapore,11/10 service!!,"Had such a wonderful stay at the Scarlet — the room was clean and it was right smack in the middle of Chinatown (so lots of food options around). But what really made this stay memorable was the amazing staff at the hotel: the receptionists at the front desk were so friendly and helpful, and one by the name of Faizz even lent us his personal charger because we forgot ours (which was a real lifesaver)! Many thanks to the lovely team at Scarlet! ♥️",5 out of 5,February 2022,4.0 of 5 stars,#17 of 372 hotels in Singapore,0.3501700680272109,0.5275510204081633,67.50850340136054,52.755102040816325,35.01700680272109,Services
The Scarlet Singapore,Staycay,Great clean rooms with an amazing service. Forgot to bring charger for our stay and the staff lent us their own personal chargers and were really nice about it. Receptionists were very friendly and welcoming which made the stay even better. Definitely recommended.,5 out of 5,February 2022,4.0 of 5 stars,#17 of 372 hotels in Singapore,0.4393518518518518,0.7000000000000001,71.9675925925926,70.0,43.93518518518518,Services
The Scarlet Singapore,Great hospitality! & loved the concept of hotel,"Booked Scarlet through an external travel app, but faced an issue when checking in. Throughout the whole few hours trying to resolve the issue with the app’s CS, Diana and Qistina was very helpful in assisting us to liaise with the external vendor, truly thankful for their help 🙏🏽 We are glad at the turn of events, and appreciate their help and hospitality! We enjoyed our stay at the premium room, and loved the balcony! Definitely coming back again to try the theme and passion suite ☺️",5 out of 5,February 2022,4.0 of 5 stars,#17 of 372 hotels in Singapore,0.22000000000000003,0.4,61.0,40.0,22.000000000000004,Services
The Scarlet Singapore,The scarlet hotel,"We went to the scarlet hotel last minutes without any reservations and been told that all the rooms are fully taken. Thank yo faizz, with a great help. Managed to get a room for us at the midnight hour. We are grateful to faizz on extension help and assistance Will be back for staycation",5 out of 5,February 2022,4.0 of 5 stars,#17 of 372 hotels in Singapore,0.26666666666666666,0.2722222222222222,63.33333333333333,27.22222222222222,26.666666666666668,General
The Scarlet Singapore,Lovely stay,"Front office staff, Qistina was very helpful, warm and accommodating. Check in was a breeze. My husband and I totally love the premium room. Lovely cosy setting. Complimentary mini bar was very nice. Bathtub was clean. The Scarlet is definitely worth the try for couples for some quiet time. Will definitely return!",5 out of 5,February 2022,4.0 of 5 stars,#17 of 372 hotels in Singapore,0.35466666666666663,0.5383333333333333,67.73333333333333,53.833333333333336,35.46666666666666,Services
The Scarlet Singapore,Romantic Getaway,"It was me and my partner's first time at the hotel. We were there for valentines. Staff Qistina and Faizz were very approachable and knowledgeable. Accommodated to our queries and demands from the beginning to the end of our stay. We were blessed with the Splendor Suite. The room turned out greater than I expected, the lounge area was super comfortable, complimentary mini bar with the free selection of sparkling, red and white wine made it all better. Room also came with a bathtub and shower area. The balcony area was perfect as me and my partner had our wonderful lunch there. Such an upgrade from the initial booking I made, kudos to Qistina and Faizz! Truly a worthwhile experience!",4 out of 5,February 2022,4.0 of 5 stars,#17 of 372 hotels in Singapore,0.3380208333333333,0.4875,66.90104166666666,48.75,33.802083333333336,Services
The Scarlet Singapore,Staycay Mode,"Friendly frontdesk, Mr Nazir and his colleague! Nice welcoming and this place is beautiful! Ive booked here three times and i am amaze by individual rooms decors. Instagram worthy! Love their comfy pillows and bed!",5 out of 5,February 2022,4.0 of 5 stars,#17 of 372 hotels in Singapore,0.5184027777777778,0.75,75.92013888888889,75.0,51.84027777777778,Services
The Scarlet Singapore,Perfect getaway!,"It was a wonderful stay in scarlet..When i first enter i was greeted by a friendly staff, Nazir, his service went beyond our expectation.. When i went up to the room, i was surprised to see swan towel deco & rose petals on the bed along with a card...Thanks to Faizal for the decoration..it was a surprise for me & my fiance.. We even extended our stay for one more night as one night was not enough for me to fully utilise the amenities in room..Ashley was really friendly when we are here on the 2nd day..she is definitely a star in front desk The room was amazing as it comes with a bathtub..It feels like a perfect getaway from work..I would definitely come back here again & would recommend scarlet to family & friends",5 out of 5,February 2022,4.0 of 5 stars,#17 of 372 hotels in Singapore,0.3428571428571429,0.5773809523809524,67.14285714285715,57.73809523809524,34.28571428571429,Services
The Scarlet Singapore,"Great place, great staff.","I really liked this hotel. The staff were super friendly. They were always happy for a chat and were responsive to requests. The balcony room was a nice size and I enjoyed sitting on the balcony watching the world go by. The bed was hard as a rock though and I struggled to sleep most nights for the 9 nights I was there. In stark contrast the pillows were super soft and my head went right through them to the bed. I called for more pillows and was only allowed 2 more (my wife also wanted 2 more for the same reason and was denied). The location is excellent. It's a stone's throw from the Maxwell Hawker and the Maxwell MRT (when it opens very soon) and a short walk to the heart of Chinatown. Hard bed aside, I'd definitely stay again.",4 out of 5,January 2022,4.0 of 5 stars,#17 of 372 hotels in Singapore,0.2883658008658009,0.5966991341991342,64.41829004329006,59.66991341991342,28.83658008658009,Services
The Scarlet Singapore,Hotel Stay after VTL Flight,"I stayed at this hotel from Dec 19 to Dec 26, 2021. I flew in on a VTL flight but had 7 days of testing to do. The hotel staff was incredibly helpful with any questions or concerns I had. Specifically, the hotel staff at the front desk named Faizz was always very helpful for any questions I had about my PCR and Art tests that I had to do, so I am grateful for his and the rest of the staff's help! With all the crazy restrictions and tests that I had to take to enter Singapore, I really appreciated this hotel for making my stay welcoming.",5 out of 5,December 2021,4.0 of 5 stars,#17 of 372 hotels in Singapore,0.1875,0.55,59.375,55.00000000000001,18.75,Services
The Scarlet Singapore,Assistant Guest Relations Manager/Beautiful Room,"Would like to thank Faizal for the welcome card and beautiful room set up. Faizal have been really helpful during my staycation..The room was Beautiful 😍 just wow 🤩..And i would also like to thank Ashley for helping me during my check in, she was very friendly and make me feel welcomed. Hayley was friendly and helpful when i was unable to tap my room card key and she helped me.",5 out of 5,January 2022,4.0 of 5 stars,#17 of 372 hotels in Singapore,0.35138888888888886,0.75,67.56944444444444,75.0,35.138888888888886,Services
The Scarlet Singapore,Trendy Boutique Hotel in Excellent Location,"I had previously hoped to stay here although circumstances didn’t allow so very pleased to experience this hotel. The staff were excellent from the moment I checked in including a pleasant upgrade to an Executive room with balcony. This included the complimentary mini bar with snacks, soft drinks and beer. Across the road from the Maxwell Hawker Street food, easy walk to the Chinatown MRT and Marina Bay etc. Special thank you to Diana (Front Office Manager) & all the staff for making my extended visit enjoyable. The hotel is quirky , being a combination of shophouses.",5 out of 5,January 2022,4.0 of 5 stars,#17 of 372 hotels in Singapore,0.3907142857142857,0.6988095238095238,69.53571428571428,69.88095238095238,39.07142857142857,Services
The Scarlet Singapore,Pleasant & Comfortable.,"Hotel is 3 minutes walk (my pace!) to Chinatown (nearest landmark being Budhha Tooth Relic Temple and Chinatown Visitors Centre. 1 min walk to Maxwell Food Centre, a popular hawker centre in the City. So the hotel is surrounded by many nice food places. The hotel building is vintage WW2 architecture shop house type. Nice ambience with friendly staff (shoutout to the bubbly Ms Ashley!). The rooftop bar is popular with yuppies from the surrounding office buildings. We took the deluxe room with balcony. Overall, the place is quiet and felt exclusively private-like. Which is amazing considering it's on the doorstep of busy Chinatown and major offices.",5 out of 5,January 2022,4.0 of 5 stars,#17 of 372 hotels in Singapore,0.39427083333333335,0.6444444444444445,69.71354166666667,64.44444444444444,39.427083333333336,Location
The Scarlet Singapore,My favourite place to stay in Singapore.,"Absolutely loved my stay at The Scarlet Hotel and I’m just sorry I didn’t discover it sooner. The hotel is housed in beautifully restored historic shop houses. The rooms wonderfully decorated and come with a complimentary mini bar. The surrounding area is filled with hip bars and eateries, cool architecture and is just opposite the Famous Maxwell Food Market. The staff are so friendly and helpful. A special thank you to the amazing Faiz and also Diana and Nazir for the warm hospitality. Can’t wait to return!",5 out of 5,January 2022,4.0 of 5 stars,#17 of 372 hotels in Singapore,0.4058673469387755,0.6729591836734693,70.29336734693878,67.29591836734693,40.58673469387755,General
The Scarlet Singapore,A wonderful experience at The Scarlet Hotel!,"My boyfriend and I went to The Scarlet Hotel on 14th Jan 2022 to celebrate his birthday. We like to give a big thanks to Haley. We were surprised by her beautiful gestures, lovely welcome, excellent services. She surprised us with an awesome room which was specially decorated with a birthday theme. The hotel sponsored a bottle of red wine, beverages and snacks. She helped us to take photos to create memorable memories. She shared with us about the hotel's Valentine's Day and Christmas promotions. That attracted us to stay The Scarlet Hotel again. It definitely worths the return visits.",5 out of 5,January 2022,4.0 of 5 stars,#17 of 372 hotels in Singapore,0.41593406593406596,0.6785714285714286,70.7967032967033,67.85714285714286,41.5934065934066,Services
The Scarlet Singapore,Excellent customer service and cute hotel,We were greeted by Nigel whose efficient and friendly manner made us feel even happier to arrive in Singapore. The following days we were greeted by Nazir. His warm and relaxed manner felt genuine. On our last few days Faizz was very helpful and efficient He managed our booking for an additional night.. All of you guys made it a memorable experience. Thanks again we really appreciate it. The Scarlet’s location is ideal for the Maxwell food court and buzzing China town. The Scarlet itself is on a quiet street.,5 out of 5,December 2021,4.0 of 5 stars,#17 of 372 hotels in Singapore,0.26458333333333334,0.40833333333333327,63.22916666666667,40.83333333333333,26.458333333333332,Services
The Scarlet Singapore,Romantic night,"This is the 2nd time my husband & I disappeared from the hussel &bustle of parenting & work to reconnect in a hotel made love. A Perfect location, clean rooms, a stocked minibar and a room with a balcony is just right. The 24 reception is fantastic, and on checking in Hailey + Faizz went above and beyond with help and friendliness. I highly recommend this venue.",5 out of 5,January 2022,4.0 of 5 stars,#17 of 372 hotels in Singapore,0.33904761904761904,0.5469642857142857,66.95238095238095,54.69642857142857,33.904761904761905,General
The Scarlet Singapore,Great location and wonderful staff,"Stayed at The Scarlet Singapore while in Singapore for 7 nights, recently. Rooms are clean, the front desk is available 24 hours, and the location gives you immediate access to Chinatown and is within walking distance to major tourist areas. The staff, from the time we checked in to the time we checked out, was extremely helpful. Not only did they provide recommendations for adventures, routes to take, cater to our requests quickly, they also help my mother and me navigate the COVID-19-related requirements and testing. I cannot reiterate enough that the staff at the Scarlett Singapore Hotel, especially Nawauri, Faizz, Nazir, and Diana, made our time in Singapore 100X better amidst the peak COVID outbreak.",5 out of 5,December 2021,4.0 of 5 stars,#17 of 372 hotels in Singapore,0.15375,0.635,57.6875,63.5,15.375,Services
The Scarlet Singapore,Feedback,"We checked in on 5th Jan 2022 and checked out on 6th Jan 2022. We were served by a staff name Faizz. We had one of the best customer service we could ever asked for. Faizz was extremely nice and polite, he helped us throughout our stay and made it hassle free. I would highly Recommend this Hotel for those who are looking to have a nice and private stay with their love ones.",5 out of 5,January 2022,4.0 of 5 stars,#17 of 372 hotels in Singapore,0.46571428571428575,0.6592857142857144,73.28571428571429,65.92857142857143,46.57142857142858,Services
The Scarlet Singapore,Definitely repeat the stay!,"First of all, I would say my countdown trip in Singapore might be impossible if without the great team of The Scarlet Singapore! Starting with the first impression in contact with helpful Anasri for inquiring and making a reservation, good deal! Following with active friendly Qistina and incredible thoughtful Nazir who made everything perfect before arrival till the whole stay. Finally with fantastic Faizz who made my stay unbelievable flawless till the farewell. They literally are 6-star people!!! Nazir arranged beyond-expected Executive room with balcony, spacious terrace and clear view of Tanjong Pagar on high floor. I could say not many stay made me feel like home like this. Good layout and stylish decorations can compensate the room size. Complimentary Italian wine and",5 out of 5,January 2022,4.0 of 5 stars,#17 of 372 hotels in Singapore,0.29625,0.6058333333333333,64.8125,60.583333333333336,29.625,Services
The Scarlet Singapore,Well situated in Chinatown,"The Scarlet is well situated in Chinatown and close access to three MRT stations. Its position is also well situated for food and shopping. No where is too far in Singapore due to excellent MRT; however, some hotels such as along Orchard Road do not allow for closer cultural experiences. Apart from Chinatown itself and the Buddha Tooth Temple, there is a nearby Taoist temple and Peranakan house to explore. It is walking distance to the Marina Bay areas as well- if you like walking. The hotel is very comfortable with rooms being very clean and quiet. The open mini bar and free breakfast was a great deal and I chose an executive room; however, the cheaper rooms were quite spacious as well. Note that these rooms may or may not have a window. Bed was firm but very comfortable and",5 out of 5,January 2022,4.0 of 5 stars,#17 of 372 hotels in Singapore,0.27628205128205124,0.6667948717948717,63.81410256410256,66.67948717948717,27.628205128205124,Location
The Scarlet Singapore,Warm customer service from Scarlet Singapore,A pleasant stay of 5 days 4 nights in the hotel suite room. Nice and peaceful ambience inside the room with splendid design along the hallway is a great place to spend with family especially during festi season. The room is spacious as well as the toilet. My family loves the bathtub with jacuzzi. Really relaxing.. Good location within Chinatown. Restaurants and eateries are all around the corners. Helpful and friendly front desk staffs with amazing hospitality during our stay. Special compliment to Faizz who assisted us with our stay as well as resolving problem for us from the start till we checked out. Thumbs up to him.. Overall wonderful experience. Well done Scarlet's Singapore!,5 out of 5,December 2021,4.0 of 5 stars,#17 of 372 hotels in Singapore,0.4582482993197279,0.6420068027210885,72.9124149659864,64.20068027210884,45.824829931972786,General
The Scarlet Singapore,ATTN: FAIZZ & TEAM (THE SCARLET)/,"Would like to extend our greatest gratitude and appreciation to FAIZZ and his team at the front desk for extending their hospitality and making our stay there a memorable one. Thank you Faizz for going the extra mile and bending over backwards to ensure we felt like we were home away from home.... Keep up the good work and wishing you and your team the best of luck and a smashing new year ahead. With Appreciation, Naz Tay & Family",5 out of 5,December 2021,4.0 of 5 stars,#17 of 372 hotels in Singapore,0.556060606060606,0.5757575757575758,77.80303030303031,57.57575757575758,55.6060606060606,Services
The Scarlet Singapore,Excellent service and friendly staff,"I had an overnight stay at The Scarlet Hotel and I am extremely satisfied with the experience. The room was in great condition and the staff are very helpful and friendly. I was assisted by Faizz Abdul and he was very helpful for my multiple requests for taxi, local currency withdrawals and late checkout. Thank you!",5 out of 5,December 2021,4.0 of 5 stars,#17 of 372 hotels in Singapore,0.21250000000000002,0.43124999999999997,60.62499999999999,43.125,21.250000000000004,Services
The Scarlet Singapore,Family staycation,"Hotel has a lovely ambience throughout my stay there. The interior design is aesthetically pleasing with their antique/modern style fusion. My check-in process was handled well and professionally by Qistina and Faizz at the reception. Housekeeping made my room clean when I came back after a day out. Not many hotels like The Scarlet Hotel have a complimentary minibar so I was quite pleased with what they provided, which included two KitKat bars! To the food connoisseurs, there are a number of F&B establishments around the area which includes both Halal and Non-Halal options. I will definitely recommend a stay at The Scarlet to my family and friends as my family and I will absolutely come back for another staycation.",5 out of 5,December 2021,4.0 of 5 stars,#17 of 372 hotels in Singapore,0.18416666666666665,0.495,59.20833333333333,49.5,18.416666666666664,Services
The Scarlet Singapore,Good customer service,I was shocked to receive a cancellation booking from Agoda on the same day that our VTL guest will check in later in the afternoon. I was attended by Faizz directly for the reservation. He has provided excellent and prompt service. I would highly recommend his service and attention to my matter.,5 out of 5,December 2021,4.0 of 5 stars,#17 of 372 hotels in Singapore,0.09333333333333334,0.47750000000000004,54.666666666666664,47.75,9.333333333333334,Services
The Scarlet Singapore,A great boutique hotel perfectly located,My wife and I stayed at the Scarlet Singapore once the VTL opened with Australia. We were warmly greeted at some ungodly hour by Faizal who looked after us and welcomed us as if we were family. We were also fortunate to be looked after by Nazir who kindly reduced the cost of our laundry because of an error by the service provider. The location was great and would stay there again. There is the Maxwell Hawker centre just a 3 minute walk away and the Maxwell MTR will possibly be open in the coming months. If you are looking for a lovely front office crew (apologies to those whose names I haven't included) stay here.,5 out of 5,November 2021,4.0 of 5 stars,#17 of 372 hotels in Singapore,0.4833333333333334,0.6999999999999998,74.16666666666667,69.99999999999999,48.33333333333334,Services
The Scarlet Singapore,Feedback,"My partner and I was attended by Faizz at the front desk. He was very professional and welcoming. The room was spacious and the toilet was filled with basic necessities. It would however be nicer if there’s more snacks or any birthday deal! All in all, we had a great stay and will definitely be back!",5 out of 5,December 2021,4.0 of 5 stars,#17 of 372 hotels in Singapore,0.2745238095238095,0.3435714285714286,63.72619047619048,34.35714285714286,27.45238095238095,Services
The Scarlet Singapore,Scarlet Hotel Review,"Received excellent and prompt service from Faizz. Thanks so much for the warm welcome and service. Room is clean, spacious and bright with free mini bar and a bottle of wine. Nice surprise with romantic touch.",5 out of 5,December 2021,4.0 of 5 stars,#17 of 372 hotels in Singapore,0.48666666666666664,0.67,74.33333333333333,67.0,48.666666666666664,Services
The Scarlet Singapore,Great service!,"Went for a short staycay here and the front desk staff Faizz was really friendly and accommodating. Had a really pleasant stay there, thank you! Hotel rooms were also clean, great ambience. We also received complimentary wine and minibar snacks!",5 out of 5,December 2021,4.0 of 5 stars,#17 of 372 hotels in Singapore,0.47222222222222215,0.6194444444444445,73.6111111111111,61.94444444444444,47.222222222222214,Services
The Scarlet Singapore,A birthday song from the Front Office Agent.,"It was my first time staying at the hotel. The purpose was to celebrate my partner’s birthday. Special thanks to Duty Manager Faizal for the pre arrival room upgrade! Spacious room with balcony! The room comes with a bottle of red wine and complimentary minibar. I have to say, Scarlett has one of the best minibar among other hotels in SG. I would like to mention Qistina (GSA) and Nigel (DM) for their warm and affectionate hospitality upon my arrival. As for the highlight of the stay. I requested for the birthday cake to be sent up to my room at midnight on the dot. And at exactly 12am, the night GSA, Faiz, knocked on my door and presented the birthday cake, lighted up, ALONG WITH A FULL BIRTHDAY SONG!! I’m very very very impressed! That’s an outstanding service! To the",5 out of 5,December 2021,4.0 of 5 stars,#17 of 372 hotels in Singapore,0.42637648809523815,0.46289682539682536,71.3188244047619,46.28968253968254,42.63764880952382,Services
The Scarlet Singapore,Friendly and understanding staff,"I had a one night at this hotel on the 28th of November and being served by the hotel staff, Faizz. It’s our first experience there and he gave us a warm welcome and introduction of the hotel. He is knowledgeable about the hotel and very approachable. I would definitely come again and hopefully being serve by him again.",5 out of 5,November 2021,4.0 of 5 stars,#17 of 372 hotels in Singapore,0.37,0.5266666666666666,68.5,52.666666666666664,37.0,Services
The Scarlet Singapore,Great stay at The Scarlet Singapore,"Great hospitality, room was clean, neat and tidy. The receptionist, Faiz was nice, patient and understanding. He briefly went through the terms and conditions for us. He also gave us information when we are not sure where to have our dinner. If anyone planning to stay at The Scarlet Singapore, don’t worry on approaching Faiz for any needs. He will help you as much as he can.",5 out of 5,November 2021,4.0 of 5 stars,#17 of 372 hotels in Singapore,0.28958333333333336,0.5840277777777778,64.47916666666667,58.40277777777778,28.958333333333336,Services
