hotelname,title,desc,reviewRatings,reviewDate,hotelClass,hotelRank,polarity,subjectivity,Normalized_Polarity,Normalized_Subjectivity,Normalized_Polarity_POS_NEG,Category
The Scarlet Singapore,Classy in a great location,"We were only there for one night in transit but would have loved to have used this as my base in Singapore a couple of weeks earlier. Very quirky but in a very interesting and classy way. Good size room with loads of free extras in room- like tea, coffee, water, safe, ""handy"" mobile phone, robes slippers etc. Regret not seeing this on my outward journey. Paralell with a street called ""Club Street"" which is full of western style bars and restaurants. But its also only yards away from Chinatown and its temples and food halls.",5 out of 5,January 2017,4.0 of 5 stars,#17 of 372 hotels in Singapore,0.2285714285714286,0.7285714285714286,61.42857142857143,72.85714285714286,22.857142857142858,Location
The Scarlet Singapore,An opulent period conversion,"Genuinely surprised by this gem of a shop house conversion that exudes some old world charm . Be it the plush , well appointed rooms , service , the rooftop bar / restaurant, quality of food etc. Well positioned behind Maxwell Centre, just off Club Street and Duxton Hill to offer a plethora of restaurants , hawker fare and bars . Loved it and will be back",5 out of 5,February 2017,4.0 of 5 stars,#17 of 372 hotels in Singapore,0.09999999999999999,0.52,55.00000000000001,52.0,10.0,Value
The Scarlet Singapore,Stop over on the way to Australia.,"Stayed in the Scarlet as a stop off on the way to Australia. Hotel is located on the edge of Chinatown in what used to be the red light district, hence the risque name. Room we had was a standard double on the side, view a bit poor as we overlooked a car park. Room was very good with nice bed, plenty of wardrobe space, good bathroom with nice toiletries, safe, mini bar, and free wifi. Air conditioning was fine if very noisy, which a call to reception, ensured it was fixed when we went out for a meal. Down side to hotel was cost of the extras, food and drink were very expensive, eat out with the locals and bring your own booze in from the local shops. Hotel is not cheap but is good value if you eat out. Singapore I regret to advise is one massive building site, you could be in",4 out of 5,December 2016,4.0 of 5 stars,#17 of 372 hotels in Singapore,0.2248148148148148,0.5466137566137566,61.24074074074074,54.66137566137566,22.48148148148148,Location
The Scarlet Singapore,"Fun, original, beautifully tacky, great service","Right in Chinatown, so well located. We booked a suite on 3rd floor - extremely well maintained with a delightful layout even though a bit small (big for S'pore!); my wife loved every bit of it! Front Desk staff couldn't be more helpful, housekeeping was spotless & amenities were top grade. Intimate rooftop bar with top Martinis & superb Italian truffle inspired restaurant - we did indulge in the master's recommendation for a Barolo - and did right! Will be back...",5 out of 5,February 2017,4.0 of 5 stars,#17 of 372 hotels in Singapore,0.32285714285714284,0.49809523809523804,66.14285714285715,49.8095238095238,32.285714285714285,Services
The Scarlet Singapore,helpful,"really great location, just by china town and financial district, chick hotel, incredibly helpful staff esp. Hafeez, clean and stylish, rather small room but very accommodating,great value for money , will stay there again",5 out of 5,February 2017,4.0 of 5 stars,#17 of 372 hotels in Singapore,0.3595238095238096,0.5785714285714285,67.97619047619048,57.857142857142854,35.952380952380956,Location
The Scarlet Singapore,Quaint and Querky,I was looking for somewhere with character to stay in when in Singapore. The Scarlet looked to fit the bill and we were not disappointed. The Scarlet is a period building in Chinatown. Handy for walking the Chinatown district but also within easy reach of the CBD and the tourist spots of the city. Although the rooms are cramped they are well appointed and comfortable. The hotel has a rooftop bar and a main restaurant which serves higher end food specialising in truffle. Both have an Italian theme. The staff are friendly and efficient. A good and reasonably priced place to stay when in Singapore.,5 out of 5,February 2017,4.0 of 5 stars,#17 of 372 hotels in Singapore,0.35454545454545455,0.5651515151515152,67.72727272727272,56.515151515151516,35.45454545454545,Location
The Scarlet Singapore,Great choice for a stopover,"Stayed at the Scarlet for just one night as I had a stopover in Singapore and, much preferring a boutique hotel to a corporate chain, it ticked all the right boxes: quirky charm, stylish, great location and excellent value for money. It's beautifully decorated (the Christmas decorations were fab throughout, given a big helping hand in that they so complemented the general decor) and the slight nod to the salacious is humorously carried through to the room do not disturb/make up my room signs. I met up with some friends who, it turned out, worked very close by and although we'd intended to just meet at the hotel rooftop bar before moving on, we simply stayed there for the evening. The bar was nice enough but nothing to write home about really. (Wine was horribly expensive,",4 out of 5,December 2016,4.0 of 5 stars,#17 of 372 hotels in Singapore,0.25105820105820104,0.5727513227513226,62.55291005291005,57.27513227513226,25.105820105820104,Location
The Scarlet Singapore,Good location but average stay,"i have heard rave reviews about the Scarlet Hotel thus we opted to stay here over the rest of the hotels in Singapore for our staycation. However, i wasn't too impressed with the stay here. 1. They offered a 10 mins treatment at the Beauty Empire - but it wasn't open throughout our stay. Worst of all, it wasn't properly communicated to the front desk, and we woke up on the day of check out expecting that it was open and we should be going for our treatment. Front desk checked on the website and it was supposed to be opened on the 3rd day of CNY. Just ridiculous when you offer something that was free, and then in the end we don't get it and it leaves a bad taste. 2. The room - really nothing fancy. It feels like a stay in your own home, and i kind of regretted opting to stay",3 out of 5,January 2017,4.0 of 5 stars,#17 of 372 hotels in Singapore,0.0638888888888889,0.638888888888889,53.19444444444444,63.88888888888889,6.38888888888889,Services
The Scarlet Singapore,Beautiful Boutique hotel in central Singapore,"Loved this place. It is very well decorated, centrally located. A little noisy as some rooms are overlooking the street but it's part of the charm. This is a good romantic spot or even business hotel.",4 out of 5,January 2017,4.0 of 5 stars,#17 of 372 hotels in Singapore,0.23541666666666664,0.4916666666666667,61.77083333333333,49.16666666666667,23.541666666666664,Location
The Scarlet Singapore,"Nice location and hotel but... ehy, a room without window?","I have been there for a couple of night. Great location just beside Club st., a lovely old time building and efficient staff. I had only a problem... a room without window, looking more like a closet than a room.. I asked for a change and I got a new room but it seems standard room with window are subject to availability so you don't know when you book if you are going to stay in a room or in a closet. I have to say that it happened quite often in Singapore when I was travelling in medium range hotels and that is quite astonishing to me... a room with no window is actually not allowed to be inhabited under european laws. Be carefull when you book at this hotel to have what you are paying for...",3 out of 5,January 2017,4.0 of 5 stars,#17 of 372 hotels in Singapore,0.2154269972451791,0.462534435261708,60.77134986225896,46.2534435261708,21.54269972451791,Location
The Scarlet Singapore,Scarlet Singapore,Hotel met or exceeded all our high expectations. Brilliant location between Chinatown and the adjacent quality bar Street....see review of Noti. All rooms had free to use mobile with all Singapore services located by Google. This was enormously helpful on our travels. Good sized and appointed rooms. Would definitely recommend and return ourselves.,5 out of 5,January 2017,4.0 of 5 stars,#17 of 372 hotels in Singapore,0.36000000000000004,0.7233333333333333,68.0,72.33333333333333,36.00000000000001,Location
The Scarlet Singapore,Stunning hotel..with pros and cons,"Well travelling Singapore to write on attractions and accommodation I choose the Scarlet as my first stay. I booked to stay in their luxury room 'The Lavish"". Described by them as ""A sanctuary of exquisite extravagance, highlighted by an arresting day bed in matching red velvet, awaits to pamper, but the centrepiece of this distinguished suite has to be the much talked about Hästens bed – Asia’s first, and valued at S$38,500. With natural fillings of horsehair, flax, wool and pine all painstakingly handmade, this Swedish masterpiece is the gracious hostess’ tempting invitation to a good night’s sleep"". The room is amazing and has many attractive features. however it did not help me sleep, the noise from the outside street was too loud, they did provide earplugs but they were not",4 out of 5,January 2017,4.0 of 5 stars,#17 of 372 hotels in Singapore,0.375,0.5097222222222222,68.75,50.97222222222222,37.5,Value
The Scarlet Singapore,Abit of a maze,We actually got lost trying to find out room as the rooms are built in shophouses but the room was overall clean & the bed was super comfy. All the floors were carpeted and gives a warm feeling walking around the hotel. Its close to Chinatown & easy to navigate once you know the landmarks.,4 out of 5,February 2016,4.0 of 5 stars,#17 of 372 hotels in Singapore,0.28888888888888886,0.4833333333333334,64.44444444444444,48.33333333333334,28.888888888888886,Cleaniness
The Scarlet Singapore,Beware of building works.,"I am a big fan of the Scarlet and returned for the third time recently. The big minus right now is the building work that is going on opposite the hotel which meant we had a view only of the large wooden boards opposite the hotel. Whilst i would return again, I would wait until this major work on a new metro station is finished.",3 out of 5,December 2016,4.0 of 5 stars,#17 of 372 hotels in Singapore,0.04606643356643357,0.2668331668331668,52.30332167832168,26.683316683316683,4.606643356643357,Location
The Scarlet Singapore,Loved our stay,"This hotel has an unbeatable location and a lovely plush ambiance. Small rooms, but that's to be expected in Singapore. Excellent service and facilities. As a tall Western person, it was funny to wear a size L bathrobe that barely closed on my waist :)",5 out of 5,July 2016,4.0 of 5 stars,#17 of 372 hotels in Singapore,0.22499999999999998,0.58125,61.25000000000001,58.12500000000001,22.499999999999996,Value
The Scarlet Singapore,"Sexy hotel, excellent service","Visited for 3nts with my husband. The reception staff are all very efficient, helpful and friendly. Our room was on the ground floor and whilst larger than average, had minimal natural light..... which was overcome with some clever lighting in the room and added to the subtle naughtiness and decadence of the place. Well located for chinatown and transport, and near some excellent hawker centres, this is the perfect base to explore singapore.",5 out of 5,December 2016,4.0 of 5 stars,#17 of 372 hotels in Singapore,0.15064102564102563,0.6256410256410256,57.53205128205128,62.56410256410256,15.064102564102564,Services
The Scarlet Singapore,"Good service, great location","This hotel is in a great spot in town, easy access to the metro and club street and chinatown. We only stayed 2 nights but enjoyed the breakfast (which included bacon, sausage and egg) - i read another review that said it didnt include this but it does!. The rooftop bar is cool and the reception staff welcoming. They also looked after our bags for 7 hours on checkout and we were able to have a shower as well at no extra charge. Then supplying a phone in the room that you can take with you during your stay and use for data and calls was a really nice touch. The only downside is no window in the room, we did pock the lower price room, which is decorated nicely and good tv channels (HBO etc) but i did miss the window, however we didn't spend lots of time in the room so not a huge",4 out of 5,January 2017,4.0 of 5 stars,#17 of 372 hotels in Singapore,0.3673611111111111,0.7631944444444444,68.36805555555556,76.31944444444444,36.73611111111111,Services
The Scarlet Singapore,comfortable and good location,the staff was friendly and the location of the hotel is very convenient. Quiet rooms suitable for honeymooners. Worth the money. Ideal for young couples. The rooms are very cosy to have a deep sleep for all.,4 out of 5,January 2017,4.0 of 5 stars,#17 of 372 hotels in Singapore,0.29166666666666674,0.45370370370370366,64.58333333333334,45.37037037037037,29.166666666666675,General
The Scarlet Singapore,Nice 3 Star Hotel with good location,"The low rice hotel is typically decorated in a kitschy Chinese style. Some may call it Boutique style. Its okay for a few nights in Singapore. For a longer stay, I did, a week I would not recommend this hotel as the breakfast is extremely boring. 1 type of cheese, only white toast, 2 types of jam, 1 type of Yogurth. My room #236 was on the extreme end of a dark narrow corridor. I counted 100 steps, All in dark pink with yellow light. The room was average and nice and as well the bathroom. It has been sold to me as a 4 star hotel which it does not live up to. 3 Stars is a fair categorization.",3 out of 5,December 2016,4.0 of 5 stars,#17 of 372 hotels in Singapore,-0.005781499202551823,0.49473684210526325,49.710925039872414,49.47368421052632,0.5781499202551823,Value
The Scarlet Singapore,Great Location! Excellent staff with an exception that almost cost them a star for me....,"We stayed at this hotel for 10 days so this review is not an ""in and out"" stay type of perspective. The location can not be beat. You are around the corner from Club Street which has great restaurants, entertainment, etc. You can walk to Maxwell Market which is a wonderful Hawker Center that offers cheap eats and the famous Chicken Rice that Anthony Bourdain boosted about. The standard rooms, however, are very small for an extended stay so make sure you ask for a larger room if you will be there beyond a few nights. The complimentary water is very nice as Singapore is always hot so be aware of that as well when packing. There is a 7-11 at the end of the street to purchase water or you can walk over to Maxwell and stock up. The staff is very friendly and accommodating for the",5 out of 5,December 2016,4.0 of 5 stars,#17 of 372 hotels in Singapore,0.2436764705882353,0.5740522875816993,62.18382352941176,57.40522875816993,24.36764705882353,Location
The Scarlet Singapore,Classy little gem!,The location was ideal for our visit. Decor smart and chic and stylish. The staff were very helpful and the hotel was spotlessly clean. We would definitely return to the Scarlett hotel we enjoyed our stay,5 out of 5,November 2016,4.0 of 5 stars,#17 of 372 hotels in Singapore,0.3829931972789116,0.6918367346938775,69.14965986394557,69.18367346938776,38.29931972789116,General
The Scarlet Singapore,Great location with amazing staff,"My stay at Scarlett was amazing, from the moment you walk into the hotel you are greeted by the most friendly staff. The staff were helpful with directing you around the city and any other questions you may have. The hotel smelled amazing, the rooms were kind of small but very well kept. I was nervous staying in a hotel without windows, however my stay was wonderful.",5 out of 5,January 2017,4.0 of 5 stars,#17 of 372 hotels in Singapore,0.38888888888888895,0.6416666666666667,69.44444444444444,64.16666666666667,38.88888888888889,Services
The Scarlet Singapore,hotel with nice ambience,"a great place for staycation in SG! clean facilities and excellent customer service! worth spending your couple time and family time here in Scarlet Hotel. most importantly, there're nice cafes and restaurants around the hotel.",4 out of 5,December 2016,4.0 of 5 stars,#17 of 372 hotels in Singapore,0.5952380952380951,0.7214285714285715,79.76190476190476,72.14285714285715,59.52380952380951,General
The Scarlet Singapore,Hidden Gem,"Front desk are very friendly, will even ask you how's your day and give you a cold water to beat the heat outside. Our room is the one with balcony, spacious. They even gave us some sweets in our room. Hotel smell is very nice and the design is elegant. We stayed one night. They provide phone that you can use when you go outside, especially for tourist. They have 10mins complementary massage. Alot of food around the area, Ann siang hill, Maxwell. Good location. Very relaxing hotel and worth the money.",5 out of 5,December 2016,4.0 of 5 stars,#17 of 372 hotels in Singapore,0.23674999999999996,0.575,61.8375,57.49999999999999,23.674999999999997,Cleaniness
The Scarlet Singapore,Quaint boutique hotel in China Town,"All walls are scarlet, place looks a bit like a movie set. Rooms are small but adequate. Service is ok but nothing spectacular. Breakfast was definitely not up to standards for a place marketing itself as a luxury hotel. It was included in my room but just had a coffee, as most of the food looked like it had been there for quite some time. I would never book a room here with breakfast, you are much better off having some in the area",4 out of 5,November 2016,4.0 of 5 stars,#17 of 372 hotels in Singapore,0.31190476190476185,0.5190476190476191,65.5952380952381,51.90476190476191,31.190476190476186,Cleaniness
The Scarlet Singapore,Scarlet Hotel - great hotel and great location,Stayed at the Scarlet Hotel for 3 days on a December business trip - location close to Chinatown and the financial offices I needed to visit. Hotel is quite unique with exotic fixtures and furnishings - comfortable room and excellent service staff with a simple breakfast to start the day. Hotel is located very conveniently to many restarants and market areas - highly recommended.,4 out of 5,December 2016,4.0 of 5 stars,#17 of 372 hotels in Singapore,0.3483333333333334,0.6107936507936507,67.41666666666667,61.07936507936507,34.833333333333336,Location
The Scarlet Singapore,"""Cosy"" rooms.","We stayed here for just 1 night pre-cruise having chosen Chinatown for its proximity to the Marina Bay Cruise Centre (just a $10 cab ride away). The location was convenient to the MRT, food & shopping. The hotel was quirky as promised and the rooms comfortable if somewhat pokey (as mentioned by other reviewers). Will probably stay at the nearby Furama next time.",3 out of 5,November 2016,4.0 of 5 stars,#17 of 372 hotels in Singapore,0.06875,0.54375,53.43750000000001,54.37499999999999,6.875000000000001,Location
The Scarlet Singapore,Style without substance,The hotel got the lavish decor in which I found it quite fun. The location is quite nice though it's not in the city centre but I think it's a nice area. The room is quite tiny but the decor and details look expensive. What I really don't like about this hotel is the service which is terrible. I requested for a cup of cappuccino in my room and it took like 40 mins. The overall experience was ok but I don't think I'll go back there.,3 out of 5,August 2016,4.0 of 5 stars,#17 of 372 hotels in Singapore,0.06999999999999999,0.51,53.5,51.0,6.999999999999999,General
The Scarlet Singapore,Small boutique hotel next to china town,I visit singapore very often for business and this time since my hotel was fully booked i checked that one which is in the same area. After a 2 days stay i can easily say now that i will not return again. Arrived late nite and the people at the reception desk having a lot of fun and laughing with no reason at all. My room was small and dark and two lamps were off. The room was on second floor just by the street which was always busy. A lot of noise from the cars and people passing by and could not even open the dark black shades. Next to my bed i found a welcome note and a set of complimentary earplugs. Now i know why...,3 out of 5,December 2016,4.0 of 5 stars,#17 of 372 hotels in Singapore,0.07444444444444445,0.39277777777777784,53.72222222222223,39.277777777777786,7.4444444444444455,Location
The Scarlet Singapore,Beautiful Boutique,"Love everything about this hotel except for the tiny room. Amenities are top notch and the location is central. It's literally down the street from Maxwell Food Center, Chinatown Complex, and Buddha Tooth Temple. It's also walkable to Clarke Quay and a short Uber ride to Gardens by the Bay.",4 out of 5,November 2016,4.0 of 5 stars,#17 of 372 hotels in Singapore,0.05555555555555556,0.3673611111111111,52.77777777777778,36.73611111111111,5.555555555555556,Location
The Scarlet Singapore,Boutique jewel in Chinatown!,"We loved our two night stay at The Scarlet. The location is absolutely perfect - it is a hop to Chinatown, skip to Club St, and jump to wider Singapore. The hotel offers all the amenities that you need; put aside time to use the roof top jaccuzzi, have a glass of wine at Aria on the roof top, and wonder the shops just outside. We stayed in an executive room with balcony, and whilst the room was small (as is common in Asia) it fit us perfectly. The bed and pillows were very comfortable, the balcony was large with a fan so we could enjoy the evenings, and the bathroom was all you needed for a two night stay.",5 out of 5,November 2016,4.0 of 5 stars,#17 of 372 hotels in Singapore,0.36802197802197806,0.5445054945054945,68.4010989010989,54.450549450549445,36.8021978021978,Location
The Scarlet Singapore,A change of scenery for me - great location,"We are normally expected to stay out in Balestier whilst in Singapore. But the Scarlet was cheaper, so I booked it myself. Hard to get dropped off and picked up by taxi as there is no parking there, but once inside it's lovely. Basically, it's the entire first floor of the shop-houses below... It was well located - breakfast in Maxwell hawker centre, and a short walk into Chinatown. Great stuff. I'll be back to here when I return - though I may wait until the work on the hawker centre is complete, as the work started very early...",4 out of 5,October 2016,4.0 of 5 stars,#17 of 372 hotels in Singapore,0.1388333333333333,0.44899999999999995,56.94166666666667,44.9,13.883333333333331,Location
The Scarlet Singapore,Great boutique hotel - perfect location,"Had a day trip to Singapore and needed to unexpectedly spend the night. Had a meeting in the Telok Ayer area and wanted a hotel in the vicinity. The Scarlet was in walking distance. I usually stay at mainstream branded venues, however since this had good reviews and I could walk to the hotel, I picked it. Quaint, friendly and well presented hotel. Looks like a small place from the entrance, but plenty of rooms. the building is old and historic, however well maintained and the decor is warm and somewhat seductive. Staff are great and check in was a breeze, considering I made the booking 10 minutes before I showed up. Room was on the small size but absolutely perfect for my stay, clean, space to work, comfortable bed, clean bathroom and all the amenities needed. I would have",4 out of 5,November 2016,4.0 of 5 stars,#17 of 372 hotels in Singapore,0.2898809523809524,0.5642857142857144,64.49404761904762,56.42857142857144,28.98809523809524,Location
The Scarlet Singapore,Great boutique hotel,"Wonderful hotel in the heart of Chinatown and very close and convenient to MRT stations, shopping and Maxwell hawker center. We practically ate breakfast there everyday. The room was spacious enough for us (2 adults and 1 toddler). We got upgraded to a king size bed which was wonderful. The staff was very polite and helpful. Would definitely recommend this place.",5 out of 5,November 2016,4.0 of 5 stars,#17 of 372 hotels in Singapore,0.2625,0.5375,63.125,53.75,26.25,Location
The Scarlet Singapore,Boutique has a brand new definition in Singapore!,"Let me start with a confession - I am not a big fan of boutique hotels. But Scarlet Singapore is definitely a welcome departure from my usual pattern of staying at 'name brand' hotels. I booked a reservation for the entire month of October 2016, on a whim. I was a true 'walk-in' booking. I am big believer that any hotel can get a good review for a short-stay. It is only when one stays for an extended period of time, that one gets to see the 'true nature' of a hotel's quality and service. I had the utmost pleasure of staying at the Scarlet Singapore for the entire month of October and it was a great experience. My first impressions of this hotel was made with the interaction of 2 lovely front-office ladies - Nomin & Chuluun. They spent almost 90 minutes to work through the",5 out of 5,October 2016,4.0 of 5 stars,#17 of 372 hotels in Singapore,0.24285714285714285,0.530952380952381,62.142857142857146,53.095238095238095,24.285714285714285,General
The Scarlet Singapore,Perfect place to stay for a couple of days. Somehow expensive but overall okay,"The rooms are a bit small but cozy. Amenities are complete and are being replenished everyday, clean and fresh towels too! I love the pillows, wish I could take them home :) Staff are polite and friendly, very conversational and always willing to help. Location is perfect, near chinatown and maxwell center. Bus stops and train stations are also near. Although it's a bit expensive compare to other hotels nearby that provides breakfast and has swimming pools. They also don't provide car service or shuttle from airport.",4 out of 5,July 2016,4.0 of 5 stars,#17 of 372 hotels in Singapore,0.1465686274509804,0.5573529411764706,57.32843137254902,55.73529411764706,14.65686274509804,Amenities
