hotelname,title,desc,reviewRatings,reviewDate,hotelClass,hotelRank,polarity,subjectivity,Normalized_Polarity,Normalized_Subjectivity,Normalized_Polarity_POS_NEG,Category
The Scarlet Singapore,Lovely stay at Scarlet hotel!,We stayed at the Scarlet hotel for 2 nights as a stop over in Singapore before a holiday in Bali. We loved the hotel and is in perfect location next to Chinatown and only 30 minute walk to marina bay sands. We loved the roof top bar on top of hotel which we were given complimentary drink vouchers for on arrival. Mini bar in room too was completely free with snacks and refreshments. The service of the staff was the highlight of this hotel. They were very attentive and informative during our stay. We had an unfortunate panic at the airport where we realised we left a bag behind with passport in!! We phoned the hotel and they luckily found it and were amazing and organised a taxi to send this to us at the airport so we could make our flight!! Special thanks to Kenneth who got in,5 out of 5,August 2023,4.0 of 5 stars,#17 of 372 hotels in Singapore,0.3131162464985994,0.6532212885154062,65.65581232492997,65.32212885154061,31.311624649859944,Location
The Scarlet Singapore,Amazing stay for culture gurus,"Exceptionally comfortable room in bed in the heart of Chinatown. Staff were amazing and so helpful, even lent me umbrella for the day after I checked out and stored luggage until I left for airport. Highly recommend!",5 out of 5,August 2023,4.0 of 5 stars,#17 of 372 hotels in Singapore,0.3,0.56,65.0,56.00000000000001,30.0,Amenities
The Scarlet Singapore,Great characterful hotel!,"Comfortable bed in a well furnished room. Old style furniture and decor gives it an authentic “Old Singapore “ feel. Large bathroom, clean and modern. Executive room has windows facing a quiet alley. Very close to Maxwell Food Court for fantastic food! Overall, happy we chose this hotel, and Ayub and his reception staff made us feel very welcome. Complimentary mini bar is a great feature!! Thanks.",5 out of 5,August 2023,4.0 of 5 stars,#17 of 372 hotels in Singapore,0.36755952380952384,0.5226190476190475,68.37797619047619,52.26190476190475,36.75595238095239,Amenities
The Scarlet Singapore,整潔舒適典雅的復古飯店,"The service staff is friendly and professional, and you can easily check in without knowing English. The room is clean and comfortable, suitable for a good rest after a day of work. There are many delicious and affordable food near the hotel. The bar of the hotel has a relaxed atmosphere, which is very suitable for a drink after work. I am very satisfied This stay experience.",5 out of 5,August 2023,4.0 of 5 stars,#17 of 372 hotels in Singapore,0.45307692307692304,0.6275641025641026,72.65384615384616,62.756410256410255,45.30769230769231,Services
The Scarlet Singapore,"Decent location, great staff, great exp","Staff could not have been more helpful, location is cool, low key in China Town, 5min cab to Clarke Quay. Check out was 12 as standard, free minibar a nice touch and a roof top terrace great. Ground floor rooms were a bit dingy, and we requested being moved to 2nd floor. Small room (as normal in Singapore) but just fine. We had a late flight from Changi and staff gave us a day room to freshen up after check out for free (thanks Freddie). V good service. Good exp.",4 out of 5,August 2023,4.0 of 5 stars,#17 of 372 hotels in Singapore,0.28703703703703703,0.5472222222222222,64.35185185185185,54.722222222222214,28.703703703703702,Services
The Scarlet Singapore,Lovely stay at The Scarlet,"I gained a couple of kilos while staying 3 nights at The Scarlet. The room came complimentary mini bar. Soft drinks, nuts, Snickers and Kit Kat were provided and topped up everyday. There's also welcome drink at the rooftop bar. The Maxwell Food Centre is just a couple of minutes walk away while the F&B heaven of Telok Ayer area is just across the Ann Siang Park. The interior of the hotel may be daunting to some with scarlet walls and warm lighting. The corridor was like a never ending maze. My room was at the far end of the hotel. Ask for nearer rooms if you have mobility issues. The room itself was spacious and comfortable. My room had a window but they placed a piece of perspex sheet that kept out most noise emanating from the bars in the street behind.",5 out of 5,July 2023,4.0 of 5 stars,#17 of 372 hotels in Singapore,0.24444444444444446,0.6611111111111111,62.22222222222222,66.11111111111111,24.444444444444446,Amenities
The Scarlet Singapore,Great place to stay and thanks to Freddie.,"The staff were very attentive, especially Freddie, who made sure any query we had was answered promptly and quickly. The Scarlet is a beautiful authentic hotel in a great location and it suited our needs well. I would highly recommend The Scarlet to anyone looking for a great place to stay in Singapore.",5 out of 5,August 2023,4.0 of 5 stars,#17 of 372 hotels in Singapore,0.4959259259259259,0.7976543209876543,74.79629629629629,79.76543209876543,49.59259259259259,Services
The Scarlet Singapore,Could have been better,Service on front desk was prompt helpful and had bag storage. The hotel is a but different and quirky. Room 212 we had wasn’t huge but expected that to be the case on second floor. A bonus of a window facing out the back was good and the room functional with no complaints apart for the being noisy with noise from both sides and music on rooftop till late on. Of course location was good. A free drinks voucher was offered for the upstairs bar after 5pm. We arrived at 5:30 on a Sunday night to be told we could drink and order food but would have to depart by 6pm !!! As they had a private function on. It would have been good if we had been informed of this on booking as the noise kept us awake when trying to catch up on sleep.,3 out of 5,August 2023,4.0 of 5 stars,#17 of 372 hotels in Singapore,0.24010416666666665,0.5395833333333333,62.00520833333333,53.95833333333333,24.010416666666664,Services
The Scarlet Singapore,Well worth considering.,"Outstanding customer service, Room was pleasant and well serviced. The bar was great and the resturant was very good. It would have been nice if the spa was operating. However, we enjoyed our stay and would highly recommend The Scarlet. Thankyou for a very pleasant stay.",5 out of 5,August 2023,4.0 of 5 stars,#17 of 372 hotels in Singapore,0.6445833333333333,0.8264583333333334,82.22916666666666,82.64583333333334,64.45833333333333,Services
The Scarlet Singapore,Great hotel,"Great location, right in Chinatown area, lots of places to shop for souvenirs. Near Buddha temple and a Himdhu temple. The room and bathroom were clean. Great shower. Comfortable bed. Only downside is no window. But we knew that. Not a big deal for one night. Friendky receptionists. Will stay there again in the future",5 out of 5,July 2023,4.0 of 5 stars,#17 of 372 hotels in Singapore,0.3058201058201059,0.5734126984126984,65.29100529100529,57.341269841269835,30.58201058201059,Value
The Scarlet Singapore,Comfortable Stay at Well Located Heritage Property (with one caveat),"Stayed 3 nights at The Scarlet Hotel Singapore in a Premium room. The room was located on the floor above street level and had large windows which allowed much natural light. We recommend requesting a room with windows for this room category. We checked in earlier and although the room (233) was ready we were charged an early check in fee of $S178, which we thought was excessive. Despited this initial issue we loved the overall heritage ambience of the property and were pleased to read in other reviews that there is a refurbisment planned for next year. The furnishings are a little ""faded and jaded"" with some stained and lifting carpets. However the hotel still maintains that heritage character and appeal. Otherwise our room was very spacious and comfortable. The bed",5 out of 5,July 2023,4.0 of 5 stars,#17 of 372 hotels in Singapore,0.1324579831932773,0.4531512605042017,56.622899159663866,45.31512605042017,13.245798319327731,Value
The Scarlet Singapore,World class Staff!!,Front staff especially the night and day managers handled every comfort and request with kindness and professionalism. Staff were even better. Special shout out to Sanantha and Dikjoi. Would stay here vs my usual hyatt chain,5 out of 5,July 2023,4.0 of 5 stars,#17 of 372 hotels in Singapore,0.1517857142857143,0.5803571428571428,57.58928571428572,58.03571428571428,15.17857142857143,Services
The Scarlet Singapore,Cozy stay in S'pore,"How lucky am i to get this cozy room.Comfortable bed and pillow and location is very convenient,train is nearby and lots nice food nearby.Chinatown is just walking distance away. Highly recommended for travellers.",5 out of 5,July 2023,4.0 of 5 stars,#17 of 372 hotels in Singapore,0.21866666666666665,0.6846666666666668,60.93333333333333,68.46666666666667,21.866666666666664,Location
The Scarlet Singapore,Heart of Chinatown,"Staying at the Scarlet was so much more interesting than a concrete and glass edifice - quirky, historic and interesting. Perhaps a little ""happy chic"" in places but all the facilities were excellent. Staff were really helpful - and there's an excellent medical clinic on the corner if, like me, you suddenly need a doctor!",5 out of 5,July 2023,4.0 of 5 stars,#17 of 372 hotels in Singapore,0.34326923076923077,0.5384615384615384,67.16346153846153,53.84615384615385,34.32692307692308,Services
The Scarlet Singapore,3 night stay,"Staff very welcoming upon arrival and throughout our stay. The bed was very spacious and comfy, our room came with a window which was a bonus. The hotel is right on China town and walking distance to the other popular areas which was great. The only thing was the hotel needed a lot of TLC and our room carpet had stains on which wasn’t nice, I didn’t want to take my shoes off. We ate in the restaurant for breakfast and it was probably the worse breakfast I had, had, I didn’t eat it and we still got charged.",3 out of 5,June 2023,4.0 of 5 stars,#17 of 372 hotels in Singapore,0.24007936507936506,0.640079365079365,62.00396825396825,64.0079365079365,24.007936507936506,Services
The Scarlet Singapore,Superb!!,"The best hotel experience in Singapore.. very nice people from housekeeping, bar tenders and receptionists.. all staff are very accommodating.. will be back here soon.. if there is a 6 star rating, I will give these people",5 out of 5,July 2023,4.0 of 5 stars,#17 of 372 hotels in Singapore,0.495,0.4,74.75,40.0,49.5,General
The Scarlet Singapore,Thank you! Freddie 10/10,"The room was very clean, I was surprised to have so many drinks available that were included (free) with the room, although what I liked the most was the service. When I checked out at 11 a.m., I wasn't sure where to go for my luggage and my flight was at 11 p.m., Freddie from reception asked me where I was going and I told him, I would like to visit UniversalDo you know if they have a place to leave the suitcases there?, and he clarified that they had a free luggage storage service, he gave me a ticket and told me to come back whenever I want to pick up my luggage, It was a 10/10 service, thank you very much! Freddie, thanks to you I got to know Universal Singapore without any problems.",5 out of 5,June 2023,4.0 of 5 stars,#17 of 372 hotels in Singapore,0.3385897435897436,0.5352991452991452,66.92948717948718,53.52991452991452,33.85897435897436,Services
The Scarlet Singapore,"Amazing First Boutique Hotel, very Family Friendly 🫶🏻","The first boutique hotel in Singapore is more than just a stay in Maxwell where it lasted at the heart of Chinatown. I stayed with my sister and her son & husband and we have no complained at all. The check in was so smooth as they assisted us very friendly to our room. Although its average size of singapore hotel, you could find enough some space for luggage, wardrobe, working desk and spacious awesome bed + bathroom. My family is very sensitive toward cleanliness but they left no spot for dust at all 🙏🫶🏻 (despite many carpeted elements inside and outside the room). What my nephew loves so much is their italian restaurant Pasta Brava! From their waffel, spaghetti, pizza to chocolate lava are amazing 🫶🏻 This hotel also walk distance to maxwell MRT that has direct access to",5 out of 5,June 2023,4.0 of 5 stars,#17 of 372 hotels in Singapore,0.26046875,0.44583333333333336,63.0234375,44.583333333333336,26.046875000000004,Value
The Scarlet Singapore,Staycation and more,So comfortable and convinient. With very helpful staff. Close to china town . Mrt. And maxwell food centre. Both standard and premium rooms were well appointed and clean. Daily restocked mini bar was a surprising gift,5 out of 5,June 2023,4.0 of 5 stars,#17 of 372 hotels in Singapore,0.2777777777777778,0.38333333333333336,63.888888888888886,38.333333333333336,27.77777777777778,Amenities
The Scarlet Singapore,The scarlet Singapour,"Nice jewel in Singapour ! After a long research we try the Scarlet hôtel , Nice hôtel , clore to everything and with an amazing room , the staff was very nice and they guide us to know some spots at Singapore, we will be back 💪🏽💪🏽💪🏽💪🏽💪🏽💪🏽💪🏽 Do not hesitate to chose it",5 out of 5,June 2023,4.0 of 5 stars,#17 of 372 hotels in Singapore,0.4466666666666666,0.7166666666666667,72.33333333333333,71.66666666666667,44.66666666666666,Location
The Scarlet Singapore,Great Hotel full of Character,"We stayed here for 3 nights and enjoyed it. The reception area is amazing - cool, smells good and extremely welcoming from the humidity outside The Staff - all over the hotel were very friendly and alway greeted you. Location wise it is excellent - across the road from Maxwell MRT - a quick walk to Pagoda Street and Chinatown. The included mini bar was a nice surprise as well Rooms were a good size and were well equipped and comfortable Overall the hotel is quaint and oozes character Would suggest it will need a soft refurbishment as far as carpets and walls but this would not stop me coming back",5 out of 5,June 2023,4.0 of 5 stars,#17 of 372 hotels in Singapore,0.3469907407407407,0.6055555555555556,67.34953703703704,60.555555555555564,34.69907407407407,General
The Scarlet Singapore,Fantastic Service,I'd like to convey my warmest regards and compliments to Mr Thiru for making our stay in this hotel an absolute pleasure. He has taken care of our needs in terms of cleaning services and has maintained a stellar service throughout my entire stay. Will be returning to Scarlet for sure! 😊,5 out of 5,June 2023,4.0 of 5 stars,#17 of 372 hotels in Singapore,0.26875,0.6659722222222222,63.4375,66.59722222222221,26.875,General
The Scarlet Singapore,Great short business trip,Nice boutique hotel with very friendly and helpful staff that make you feel welcome. I love that the minibar is complementary and refilled daily which also includes beer. The rooms are all different in design and layout as the hotel spans along the street which has a different appeal compared to the usual hotel where all rooms are identical.,5 out of 5,June 2023,4.0 of 5 stars,#17 of 372 hotels in Singapore,0.2671875,0.575,63.35937499999999,57.49999999999999,26.718750000000004,Amenities
The Scarlet Singapore,Scarlet Singapore,"The Scarlet provided a fantastic opportunity for me and my family. The team, lead by Jocelyn organised a surprise celebration of my mothers 60th in the conference room free of charge. This was just the tip of the iceberg when it came to our experience. The rooms were tidy, the staff were all amazing, and the location was fantastic (located directly near public transport). Seriously, all staff were amazing and I hope their hard work does not go unnoticed by their managers. Thank you Scarlet.",5 out of 5,June 2023,4.0 of 5 stars,#17 of 372 hotels in Singapore,0.20681818181818182,0.6795454545454546,60.340909090909086,67.95454545454545,20.681818181818183,Services
The Scarlet Singapore,Sensational Scarlet,"The best thing about the Scarlet Singapore is it’s exceptional staff. I have travelled widely and the consideration, helpfulness and overall pleasant attitudes displayed by all the staff are to be commended. I would stay here again simply on the basis of its lovely staff. The rooms are clean and comfortable and the location is great.",5 out of 5,June 2023,4.0 of 5 stars,#17 of 372 hotels in Singapore,0.43666666666666665,0.6023809523809524,71.83333333333333,60.238095238095234,43.666666666666664,Services
The Scarlet Singapore,I highly recommend,I stayed at your hotel on the 7 th of June and check out at 8 th l had a very long journey and was hungry l asked your staff at the reception if they can remove the wine and drinks and give me food as l ran out of cash and they refused l ask if they can reach out to the manager of l can get any food l don't mind later on the reception girls bring apples to my room and said this is what the manager said we can do l wonder where is humanity all those food thrown in the cabage by the end of the day they feel pain to give a human being later on l was getting lost then l met a lady from house keeping Sophanna she greeted me with a smile and ask how my day was going so l told her that lm lost l can't find my room she walk me to my room and ask if l have eaten l told her l have ran,5 out of 5,June 2023,4.0 of 5 stars,#17 of 372 hotels in Singapore,0.047,0.144,52.349999999999994,14.399999999999999,4.7,Services
The Scarlet Singapore,Excellent Service in China Town,"The staff was incredibly kind, helpful, and attentive, we felt welcomed immediately. It was our first visit to Singapore and they ensured that the trip got off to an excellent start. The location is ideal as well, including easy access to China Town and the Maxwell Hawker. I highly recommend the Scarlett Hotel.",5 out of 5,June 2023,4.0 of 5 stars,#17 of 372 hotels in Singapore,0.5347619047619048,0.7866666666666665,76.73809523809524,78.66666666666666,53.476190476190474,Services
The Scarlet Singapore,"Lovely hotel, nice location, friendly staff.","Lovely two nights stay here. Complimentary mini fridge which was refilled each day. Staff were lovely, and even assisted us on getting our free drink on the roof top bar even when it was being used for an event. Very clean, cool(air con is brilliant as Singapore is so humid). Would book again if I’m Singapore.",5 out of 5,June 2023,4.0 of 5 stars,#17 of 372 hotels in Singapore,0.5109523809523809,0.7442857142857143,75.54761904761904,74.42857142857143,51.095238095238095,Amenities
The Scarlet Singapore,Exceptional staff,We stayed for 4 nights in luxury room with balcony chose balcony room to have window As some rooms only have skylight balcony was overlooking car park however outside humidity was too hot to sit outside Lovely room however very small we had large cases but just managed We had complementary mini bar filled daily which was a bonus and nice to come back to a beer or soft drink and pickies Rooftop bar plus complementary drink voucher to use which was a nice touch Very comfy bed and lovely decor The hotel was very decadent and clean with beautiful furnishings All The staff were amazing so helpful especially Eileen who was new and was on training she was a gem Bottled cold water was always on hand location was perfect 2mins from MRT 5 mins china town 2mins from Maxwell food,5 out of 5,June 2023,4.0 of 5 stars,#17 of 372 hotels in Singapore,0.24314417466591387,0.6218746470920384,62.15720873329569,62.187464709203844,24.314417466591387,Amenities
The Scarlet Singapore,"Room with a balcony, be careful of room 207","I have stayed in this hotel more than once, even in their topsuites, and it has great plusses, such as friendly staff, very convenient location in Chinatown and complementary mini bar. So overall a good choice. However, if you pay the extra for a room with a balcony and breakfast, mind the following. Avoid at all cost the tienest balcony room they have, room 207 where using the toilet is a challenge. As to breakfast, it starts at 07:45. If your first business appointment is early, forget about breakfast. The hotel did call me to offer another room, but it is a pity that was done after I made a remark on the size of the room.",3 out of 5,June 2023,4.0 of 5 stars,#17 of 372 hotels in Singapore,0.21474358974358976,0.3217948717948718,60.737179487179496,32.17948717948718,21.474358974358974,Value
The Scarlet Singapore,A good stay,Stayed here for four nights. Room was good (executive). Staff were very pleasant. As it was my partners birthday they even left us a bottle of white wine and a card. A lovely touch. We used two or three taxis and they were quite happy to arrange. It is quite close to Chinatown and a train station. From the station it will take you direct to the gardens by the bay. Would stay here again.,5 out of 5,June 2023,4.0 of 5 stars,#17 of 372 hotels in Singapore,0.4361904761904762,0.5357142857142857,71.80952380952381,53.57142857142857,43.61904761904762,Services
The Scarlet Singapore,I really wanted to give you 5 stars... but,"I really wanted to love this hotel more... but here are my disappointments: The bed was uncomfortable. Lumpy and just a sheet directly on the mattress; No sheet, just a doona... I want a top sheet as well as a doona. Breakfast included - expected a full buffet, but just a few poor choices a la carte. The first morning a slice of white toast with a single slice of ham and a bit of scrambled egg. Second morning a dessert glass with a tiny amount of yoghurt and cereal. Hardly enough to sustain an adult. The hotel is getting a bit tatty, broken door handles, chipped paint, and tables in the rooftop bar have peeling stickers on them. Yuk. Sand and restain them! Our room had a borded up window... But on the plus, staff were lovely, it's a great funky place. I gave you 4 stars",4 out of 5,June 2023,4.0 of 5 stars,#17 of 372 hotels in Singapore,0.10142857142857142,0.4298809523809523,55.07142857142857,42.988095238095234,10.142857142857142,General
The Scarlet Singapore,A great time in Singapore,"The bed is wonderful like a cloud ☁️ it was wonderful! The Personal is attentive to us for all the details, thanks to Faizz and his team to all the gesture ! In the middle of Chinatown, you can do all by foot and visit many temples. Even going to the Marina Bay. For the breakfast there is Maxelwell market at 3 min by foot if you want to explore 😌",4 out of 5,June 2023,4.0 of 5 stars,#17 of 372 hotels in Singapore,0.45,0.5571428571428572,72.5,55.714285714285715,45.0,Location
The Scarlet Singapore,Friendly Service,"I love this hotel. the vibes are like the john wick contonental legendary hotel, it find to place, strategic, and unique. also, i am very impressed with faizz, he is so nice, humble, yet professional. really love his hospitality😎",5 out of 5,June 2023,4.0 of 5 stars,#17 of 372 hotels in Singapore,0.484375,0.7124999999999999,74.21875,71.24999999999999,48.4375,General
The Scarlet Singapore,Must go,fantastic service. Faizz makes you feel home. Such a warm welcome. I strongly recommend. Great rooftop with 2 free drinks. Great jazzy music (this is so unusual nowadays). Neighborhood with a temple and narrow streets woth great pubs and restaurants.,5 out of 5,May 2023,4.0 of 5 stars,#17 of 372 hotels in Singapore,0.4575757575757576,0.7348484848484848,72.87878787878788,73.48484848484847,45.75757575757576,Amenities
The Scarlet Singapore,"Fantastic stay, highly recommend.","Comfortable rooms, amazing location right in the middle of the good bars and restaurants, but the standout part of our stay was the customer service we received at our stay at The Scarlet. Everyone working at the Scarlet were so friendly and helpful we we needed them. Would highly recommend.",5 out of 5,April 2023,4.0 of 5 stars,#17 of 372 hotels in Singapore,0.3601020408163266,0.5536734693877551,68.00510204081634,55.367346938775505,36.01020408163266,Services
The Scarlet Singapore,❤️ Singapore,Awesome Hotel and staff very friendly and always happy to help and assist. We had a nice big room with a bath and shower and free mini bar stocked daily. Good local bars and Maxwell food court literally across the road with loads of tasty foods to try.Great location for MRT and China Town. Would highly recommend..Thank you 🙂,5 out of 5,May 2023,4.0 of 5 stars,#17 of 372 hotels in Singapore,0.41475,0.5690000000000001,70.7375,56.900000000000006,41.475,Amenities
The Scarlet Singapore,Amazing customer service,"The hotel is located in a very good area, right next to Maxwell Food Centre and close to Marina Bay Sands as well. The service of the hotel is amazing especially from the receptionist called Faizz. He’s very very friendly, helpful and happy. Makes the experience of staying in this hotel even better.",5 out of 5,April 2023,4.0 of 5 stars,#17 of 372 hotels in Singapore,0.44790178571428574,0.6707142857142857,72.39508928571429,67.07142857142857,44.79017857142858,Amenities
The Scarlet Singapore,"Charming hotel with great staff, good price-value","I stayed at The Scarlet for 3 nights and can only recommend it to anyone! Very friendly staff, especially Mr. Faizz from the front desk, he provided me with all information I needed to make my first stay in Singapore rememberable. The hotel is located between Downtown and Chinatown, perfect to explore the city, even on foot! Cozy rooms, reasonable rates, you stay in a place with lots of history and charm. The only minus are the old windows, so you hear some noise from outside. Hopefully they change that when they do renovations later this year. Thank you very much for a wounderfull time!",5 out of 5,May 2023,4.0 of 5 stars,#17 of 372 hotels in Singapore,0.15865384615384615,0.5341025641025641,57.932692307692314,53.41025641025641,15.865384615384615,Location
